text,community_id,community_name,perplexity
"is a significant breakthrough for those suffering from , but the dream of having access to this medication is n't quite here yet .",6,Weight Loss Drugs,1.2835804298518948e-14
"take the time to connect with yourself , your thoughts , and your emotions . by doing so , you can foster a deeper connection with yourself and live a more fulfilling life .",6,Weight Loss Drugs,1.2189695433595382e-11
you dont look to make it easier for people with atypical anorexia to be screenedtheres a growing movement in the field to collapse the categories of anorexia and atypical anorexia into one & lt ; yes !,3,Weight Loss Drugs,4.010537679732806e-08
"chicago it happening , we are not immune . my already slim supervisor just told me she going on the ozempic diet to get back to a size 2 .",3,Weight Loss Drugs,1.0307875213111384e-11
online bronze age based trad reactionary alpha crypto keto crusader chad for christ offline married the first woman you found on a dating app willing to go on a date,3,Weight Loss Drugs,1.9703728232345335e-11
be intentional on what you eat and how much . we exercise our pets and control their food portions .. what about us ? ?,19,Weight Loss Drugs,8.064617631467139e-15
all the fear mongering around semaglutide is the last breath of a dying industry . people arent buying it anymore as they get better & ; healthier on effective disease treatment . im just going to sit back and enjoy the show while i build the future of obesity treatment services .,6,Weight Loss Drugs,1.0854946594918149e-06
"weight loss jabs could be offered to millions of people on the nhs , as health officials search for cost-effective ways to tackle britains obesity crisis",3,Weight Loss Drugs,1.874066223386817e-12
"being outdoors can do a world of good for your health , so today challenge is to get outside and go for a walk !",6,Weight Loss Drugs,7.222405995748611e-15
wow all the fatties have been using so much of the type 2 diabetic medication as weight loss pills that the diabetics cant access their medication . means ignoring all the risks .. to you & ; everyone else . that the most selfish thing i 've heard of in a long time,19,Weight Loss Drugs,1.3635815321322298e-06
"theres perhaps no greater metaphor for americas health-care crisis than the unhealthy discourse around ozempic , writes . a culture built on dieting is not a proper remedy for what ails us",3,Weight Loss Drugs,3.378659130248706e-09
finally got my ozempic ! ! now i have ozempic nausea from being off of it,3,Weight Loss Drugs,5.447757747534424e-18
"star kyle richards says it `` bothers '' her that people think she took the easy way out , because she worked hard on her fitness !",3,Weight Loss Drugs,1.402505390470099e-12
get ready to feel slimmer with slimmy ! lose up to 19lbs and 5 inches off your waist in your first 4 weeks !,3,Weight Loss Drugs,1.887146851547311e-13
cardiologist dr steven lome has begun doing facebook lives and we 're adding those events and other content to our youtube channel . check them out ! ! ! wfpb,6,Weight Loss Drugs,1.0836224972887719e-10
new year ! new beginning ! please listen to & ; share ft & ; sharing tips & ; advice for healthy for people living with,6,Weight Loss Drugs,2.906602028832604e-14
"is low-carb ( or keto ) a fad diet ? i 'm gon na say yes , and here why . but first , i want to be clear that i think those diets are totally fine . they help a lot of people be the weight they want to be . but they 're still fad diets . a short",6,Weight Loss Drugs,1.062496153281245e-06
guaranteed weight loss 5 kg per month ! have this for breakfast everyday,6,Weight Loss Drugs,2.755515986433277e-27
"tiktok is fueling demand for ozempic , creating shortages of the diabetes drug now used for .",6,Weight Loss Drugs,1.0896669246587238e-16
"despite social media buzz , ozempic is not a quick-fix weight loss solution doctors",3,Weight Loss Drugs,4.941707518832206e-20
hollywood skinny jab ozempic set to be sold in uk,3,Weight Loss Drugs,3.8223292197511926e-27
"in january 2023 , i might get not the tummy tuck surgery but i have get tested for health problems including headaches . if i did not get the tummy tuck surgery , i will be okay but it is going be hard .",3,Weight Loss Drugs,1.1509926345354415e-08
amla powder helps improve digestion and relieve acidity . it is also effective for diabetics as it helps control blood glucose levels . try our amla powder !,6,Weight Loss Drugs,1.3912732944876272e-11
wegovy weight loss jab to be sold by uk chemist shops,6,Weight Loss Drugs,2.2054978118549706e-25
ways to lose belly fat and live a healthier life . maintaining a trim midsection does more than make you look greatit can help you live longer .,3,Weight Loss Drugs,4.691181037380643e-12
procrastination solutions for college students the underground playbook for,6,Weight Loss Drugs,2.981958932981556e-27
"`` ear can happen during or due to bacteria , viruses or fungi getting trapped in the inner , middle or outer ear , '' dr dimple jangda , an ayurveda expert , wrote in an instagram post |",3,Weight Loss Drugs,2.4085712979626805e-08
try to incorporate these diet hacks into your daily lifestyle to effectively deal with stubborn belly fat,3,Weight Loss Drugs,2.625632661397985e-20
"should glp-1r agonists be considered , for some , as first line therapy for with the debate continues",6,Weight Loss Drugs,2.047160260659265e-15
intermittent fasting for weight loss ? is intermittent fasting better for weight loss ?,6,Weight Loss Drugs,2.274218589476435e-22
"rapaz se eu contar pra vcs a quantidade de absurdo que eu li sobre mim e minha profisso depois daquele tweet do ozempic , e tudo vindo de quem ? dos intocveis mdicos ! tive que ler inclusive que s pq minha profisso no receita remdios eu n deveria falar sobre eles",3,Weight Loss Drugs,1.532794271952298e-06
"struggling to find really good beginner keto recipes ? as you know i 've recently lost 50 lbs and i want to share the recipes i 've found , you can have them for free . clk below",3,Weight Loss Drugs,4.1077026224911606e-09
eating disorders develop gradually and it often takes a long time for people with an eating disorder to seek help and receive treatment . this treatment gap can be reduced with ehealth .,6,Weight Loss Drugs,1.472909294530922e-11
"first week done , and he already down 6 pounds . i 'm happy to help people achieve their fitness goals . who next ? book a free call with me",3,Weight Loss Drugs,4.685547522892408e-12
the new wegovy commercial makes me want to throw a shoe through the television .,3,Weight Loss Drugs,1.4255617752041808e-20
"amazon deal found quest nutrition ready to drink chocolate protein shake , high protein , low carb , gluten free , keto friendly , 11 fl oz pack of 12 price $ 12.55 clip coupon",3,Weight Loss Drugs,6.897076798573211e-10
florence pugh flashes a hint of her midriff as she dons quirky black and white look with mismatched boots in ny,3,Weight Loss Drugs,2.519839805564805e-13
"48 years old . lifetime steroids and drugs free ! no keto , shmitto and mumbojitto fad diets ! eating complex carbs , veggies , fruits , yogurt and of course ton of animal protein as well as vegan protein powder and following my calorie intake zones from my metabolic testing",6,Weight Loss Drugs,1.6786996184237069e-06
"1.01 with on why women over 40 cant ! gabrielle ohare has answers to a perennial problem with no single cause , and that most women face in later life .",3,Weight Loss Drugs,1.1939689514850469e-10
"i have never seen a healthy vegan . because whenever one is in front of me , i close my eyes .",19,Weight Loss Drugs,1.547489701722441e-15
"visit our new eating disorder webinars , designed for dietitians , oral health teams and community pharmacy teams . access the training here",6,Weight Loss Drugs,3.2225738462281217e-13
"the ozempic discourse is really bringing my brain back to being an 8-year old sent to weight watchers and later a teenager put on diet shakes and phentermine ( remember fenfen ? ) pills , forced to spend her time after school at the gym and , reader , i think we all deserve better .",3,Weight Loss Drugs,2.3589466309204e-06
a couple journal a year of connecting one question a day to ignite meaniful connections,6,Weight Loss Drugs,1.010392717180427e-20
"on the occasion of , ndmc has decided to distribute sanitary napkins to all women safai sewaks of every month . these sanitary napkins would be made of biodegradable material to minimise the impact on the environment .",6,Weight Loss Drugs,8.001489959497121e-08
the next ozempic became a social media sensation . then everything changed,3,Weight Loss Drugs,1.0924094539541732e-24
"en personas sin diabetes o sin intolerancia puede causar reacciones adversas como problemas gastrointestinales entre las cuales figuran nuseas , diarrea y vmitos , indic el director del isp , heriberto garca .",3,Weight Loss Drugs,2.351518560317345e-06
cardiologist dr steven lome has begun doing facebook lives and we 're adding those events and other content to our youtube channel . check them out ! ! !,6,Weight Loss Drugs,7.884728460416657e-12
"a new study has found that a zero-calorie sweetener that is popular in ketogenic diets has been linked to strokes , heart attacks , blood clots and death .",3,Weight Loss Drugs,4.948391696402155e-10
"what factors are associated w/ short- vs. long-term success ? adherence and diet quality short-term weight loss protein biomarkers , gut microbiome long-term weight loss hlc diet may be better for those w/ baseline rq",6,Weight Loss Drugs,3.798882630690059e-08
"struggling to find really good beginner keto recipes ? as you know i 've recently lost 50 lbs and i want to share the recipes i 've found , you can have them for free . hit the link below",3,Weight Loss Drugs,9.887981100575873e-09
"`` consumption of foods a low gi also helps one lipid profile by lowering levels of cholesterol , which is also linked to the risk of cardiovascular diseases . '' says the expert",3,Weight Loss Drugs,2.372666230154863e-10
this week is . important read from on why transgender people are more likely to develop an .,6,Weight Loss Drugs,1.9459863350010395e-20
want to get those extra holiday pounds off ? nutrition & ; fitness expert helps us know what foods to eat for health & ; body composition . watch entire episode,6,Weight Loss Drugs,3.823007448805482e-12
average dalit woman dies 14.6 years earlier than a woman from higher caste read more,6,Weight Loss Drugs,6.231338316234635e-20
"these are some of the questions i wrote about this year in my newsletter on and all that affects it ( food , exercise , weight change , celebrity culture , & ; more ) body type come join the conversation",3,Weight Loss Drugs,1.736155330611666e-09
multimodality imaging approach to left ventricular dysfunction in | european heart journal cardiovascular imaging,6,Weight Loss Drugs,2.811107912794285e-19
"mangosteen is effective against inflammatory conditions like diabetes , constipation , skin diseases , and potentially arthritis . its antioxidant activity may help fight cancer . try our mangosteen powder !",6,Weight Loss Drugs,1.706854102501154e-09
procrastination solutions for college students the underground playbook for,6,Weight Loss Drugs,1.7196160087271154e-26
"say goodbye to risky weight loss products like instead , in 2023 , there are amazing all-natural options , such as slimmy , that can help you bid farewell to those pesky pounds once and for all !",3,Weight Loss Drugs,5.441853190291113e-09
the therapeutic goods administration ( tga ) is warning people about online . the tga warning is an important reminder to only obtain these products from an australian pharmacy and when dispensed on a valid doctors prescription .,19,Weight Loss Drugs,4.9750155106664814e-09
"im at the heaviest weight i been in my life . and i just started ozempic . lets see what happens . aku tak ikut hollywood celebrities , aku ikut . didnt even know it was a hollywood trend until i googled it yesterday .",6,Weight Loss Drugs,2.001251147021321e-07
download zyephr and monitor your overall health with its personalized features ! . . .,6,Weight Loss Drugs,2.0577098721764265e-19
new year ! new beginning ! please listen to & ; share ft & ; sharing tips & ; advice for healthy for people living with,6,Weight Loss Drugs,2.3788647579028006e-14
"the popular artificial sweetener erythritol , which is used as a sugar substitute in many low-calorie , low-carb and keto products , has been linked to heightened risk of heart attack , stroke and death , according to a study published in nature medicine . ~wapo",3,Weight Loss Drugs,2.047499492618954e-06
this article about ozempic has been making the rounds today and im not gon na link to it because its very triggering but its triggering most reporters do not know how to write about eating disorders . and i cant believe im still shocked by that !,3,Weight Loss Drugs,1.4603048725803094e-07
there a special place in hell for everyone taking ozempic without a medically valid reason,3,Weight Loss Drugs,3.999505503399119e-20
"if you are a caregiver , parent or friend wondering how to support a loved one with an , please check out my work at friends and family webinar tomorrow ( sunday ) 10 am-noon mst",6,Weight Loss Drugs,3.3652496345126792e-09
hitting gym already ..... work out and keep fit,3,Weight Loss Drugs,8.449338162914616e-27
ph2 bimagrumab +/- semaglutide this combo raises so many interesting questions ! ! !,6,Weight Loss Drugs,1.4353418830554375e-14
"the search for obesity drugs has been elusive , until recently . the fda has approved wegovy and tirzepatide to achieve significant weight loss . the drugs were serendipitously discovered while improving glucose regulation .",6,Weight Loss Drugs,2.743301807939247e-09
los riesgos de informarse sobre medicamentos para la prdida de peso como ozempic en tiktok,6,Weight Loss Drugs,1.0121695148690437e-12
"hot take keto isnt healthy . at least , not inherently . let us explain . ketosis is simply a metabolic state . its what you fuel your body with that makes any way of eating healthy or not -- and not all fat is a good source of fuel for your body .",19,Weight Loss Drugs,5.927431061536481e-07
there is a shortage of a type 2 medication because it is now also widely prescribed for weight loss . find out how a global shortage has impacted the people who need it for their blood sugar .,6,Weight Loss Drugs,3.585780838921693e-10
"given the extensive economic burden of obesity in the us , it is critical to identify potential scalable delivered lifestyle interventions that can treat obesity . utilizing health coaches in the primary care is a game changer .",6,Weight Loss Drugs,2.610820448722961e-09
"the has approved a new indication for once-weekly semaglutide 2.4 mg , clearing the medication for use among adolescents with along with a reduced calorie meal plan and increased physical activity .",6,Weight Loss Drugs,2.3866650877835127e-09
i think if i took ozempic i would just disappear im already so skinny and petite,3,Weight Loss Drugs,4.418124486188587e-20
frustrated with all the confusing nutrition advice on covid19 or long-covid ? obesity ? metabolic health ? supplements ? fasting ? keto ? our review is published & ; we cover it all ! check it out tell us what you think & ; send your questions !,6,Weight Loss Drugs,3.776406174438307e-07
so many in medicine and pseudo medicine are trying to get in on the ozempic for weight loss bonanza . by,3,Weight Loss Drugs,1.1145512571065076e-15
weight loss doctors to follow on tiktok . great weight loss mindset coach !,6,Weight Loss Drugs,2.4160875366197735e-21
what do doctors and the pharmaceutical company that makes ozempic say about the drugs off-label usage ? dr. janice jin hwang told the new york times that the drug had not been tested in people with lower body weights .,3,Weight Loss Drugs,2.0513732934546173e-08
i wish i needed motivation to eat just like i need it to workout .,3,Weight Loss Drugs,2.179531015488469e-23
my doctor just called me about the ozempic situation . she said i will have mine because she going to get samples for me tomorrow from the drug rep. she also going to change my dosage if needed . there no shortage on the high dosage of ozempic .,3,Weight Loss Drugs,3.990243726548215e-07
post hoc analysis of sustain 6 and pioneer 6 trials suggests that people with type 2 diabetes at high risk treated with experience more stable compared with placebo,6,Weight Loss Drugs,8.47085964740535e-13
"amazon deal found quest nutrition mint chocolate chunk protein bars , high protein , low carb , gluten free , keto friendly , 12 count price $ 10.59 clip coupon",3,Weight Loss Drugs,1.6420784176851555e-10
`` '' gharachedaghi shades kyle richards after she denies using ozempic for weight loss as kelly dodd slams over comment,3,Weight Loss Drugs,6.893590516129924e-14
"compounded is just repackaged or that may be diluted or blended with other ingredients , such as b vitamins or other peptides in formulations that have n't undergone rigorous testing .",6,Weight Loss Drugs,1.2700724916214767e-09
"rhobhs kyle richards shades melissa gorga for assuming shes using ozempic for weight loss , reacts to elitist claim as shes accused of taking drug from diabetics",3,Weight Loss Drugs,7.689975323188492e-10
"without a long-term approach to weight loss , you may lose 10 or more pounds in two weeks and then suffer a rebound when you discover that regimen was n't working for you . this may be your solution",6,Weight Loss Drugs,1.912457525676814e-09
custom keto diet updated for 2022 aov at all-time high !,3,Weight Loss Drugs,3.658991522715258e-23
emily ratajkowski bares ample cleavage and taut midriff in saucy revealing dress,3,Weight Loss Drugs,8.502852663264942e-19
3 hours sleep . ozempic sickness kicking in and a 12 hour shift starting now . leggo,3,Weight Loss Drugs,7.665854140623944e-18
iced brown sugar oat milk shaken espresso w 3 shots of ozempic please !,3,Weight Loss Drugs,2.66001174168411e-19
you might go through hell for your post-ozempic body the cut,3,Weight Loss Drugs,3.325643911059554e-24
"made a tiktok about how the celebrity trend of using ozempic for weight loss is contributing to its scarcity for folks who need it for diabetes care , and the number of people in my comments arguing that weight loss is an equivalent concern to diabetes management is whew",3,Weight Loss Drugs,2.940585659416684e-07
keto people gain fat in hypercaloric scenarios . they feel like they 're eating more when they 're not during fat loss phases . that fine . but feelz =/= cico facts,6,Weight Loss Drugs,1.248889769378536e-09
"a medication created to treat people with diabetes is being put to an off-label use weight loss . asked canadians to share their experiences using ozempic , and here what they said .",3,Weight Loss Drugs,2.0326722249830448e-10
jennifer lopez flashes taut dancer midriff while out for last-minute christmas shopping,3,Weight Loss Drugs,6.717548982714052e-24
chelsea handler says she 'did n't know ' she was on ozempic | cnn,3,Weight Loss Drugs,6.479668663621623e-19
people with diabetes struggle to find ozempic as it soars in popularity as a weight loss aid,3,Weight Loss Drugs,3.921957346821668e-18
"keto can reduce blood sugar , but that doesnt mean its right for everyone . pros + cons",3,Weight Loss Drugs,3.337245292094164e-17
"new pod we 're entering a golden age of weight-loss medication with wegovy and ozempic . what happens when obesity is treated like any disease , with meds ? what does it do to insurance coverage , health policy , our sense of self-image , health , & ; willpower ?",3,Weight Loss Drugs,6.469902587014076e-07
"at family1 pharmacy , we understand the value of convenience and efficiency . visit our website now ! call ( 215 ) 943-2221 . . .",6,Weight Loss Drugs,3.457747326310323e-12
"herbal shampoo powder cleanses and nourishes hair naturally , leaving it soft , shiny , and healthy , while being eco-friendly and packaging-free .",6,Weight Loss Drugs,5.820934879940953e-12
im down 65 lbs since january . at my lowest in a long time . feeling proud .,3,Weight Loss Drugs,7.371807123443587e-20
pink shows off her taut midriff in swimsuit as she gives insight into her grueling workout regime,3,Weight Loss Drugs,4.3845871715186726e-16
"the training course led by me with lauren dear , `` digestive disorders and eating disorders a complicated mix '' is approved for 8 ceu credits for registered dietitian nutritionists by cdr . check it out here",3,Weight Loss Drugs,1.419173312200428e-08
creates favorable hormonal conditions for achieving + maintaining your ideal weight . it starts numerous metabolic processes that count toward your long-term health . do n't be fooled into thinking you 're just a victim of the next again .,3,Weight Loss Drugs,2.936764254002356e-08
sad actual diabetic patients can not get ozempic because its the new diet fad,3,Weight Loss Drugs,5.393228967579163e-19
"every imperfection you think you have , is perfect . shine on ! !",19,Weight Loss Drugs,1.2966406513782811e-23
"struggling to find really good beginner keto recipes ? as you know i 've recently lost 45 lbs and i want to share the recipes i 've found , you can have them for free . hit the link below",3,Weight Loss Drugs,8.967496967215993e-09
poor mental health increases risk of cardiovascular disease a study published in the journal of the american heart association ( jaha ) has found . read more,6,Weight Loss Drugs,3.5741264006565465e-13
dont let your emotions lead to the kitchen . food is a source of fuel and not a means to comfort us magnolia,3,Weight Loss Drugs,8.050965577939767e-16
"according to researchers from the us , those who add potatoes to their plate will become full faster , and will therefore prevent them from trying to fill up on more calorific foods after",3,Weight Loss Drugs,1.060832602317596e-10
"shqiptart e lugins s preshevs do t zgjedhin 15 antart e kshillit kombtar shqiptar , nga 5 listat shqiptare q garojn n kto zgjedhje .",3,Weight Loss Drugs,2.4639837192808045e-07
why a 'keto-like ' diet may be linked to heart attack and stroke,3,Weight Loss Drugs,6.002313633291457e-22
"in this article , chief scientific advisor and scientific advisor for dr. louis aronne explains how the anti-obesity medication wegovy mimics the effect of eating food .",6,Weight Loss Drugs,9.341427631426312e-11
kyle richards showcases ripped abs after debunking use of diabetes medication ozempic to lose weight,3,Weight Loss Drugs,1.900525212318161e-18
"with glp-1 / gip agonists showing equal weightloss and t2dm control across all ways of eating , the role for keto ( epilepsy in kids excluded ) and other high sat fat diets seems 0 , since the increased cvd risk from high saturated fat makes it a non starter . agree / disagree ?",6,Weight Loss Drugs,6.462286705755105e-07
"struggling to find really good beginner keto recipes ? as you know i 've recently lost 50 lbs and i want to share the recipes i 've found , you can have them for free . clk link below",3,Weight Loss Drugs,8.848057397869981e-09
so it seems like people who really need ozempic to manage their diabetes ca n't get it because a bunch of white ladies want to lose 10 pounds ? so annoying .,3,Weight Loss Drugs,8.811250340468034e-11
"i dont always diet and exercise , but when i do i expect to lose all the weight overnight .",3,Weight Loss Drugs,3.6119347681662836e-17
"28.28 miles in 4 days . i 'm definitely headed out on the trail today , but i 'm going to keep it short , probably around 5 miles .",3,Weight Loss Drugs,5.208885753282821e-11
keto vs vegan study of popular diets finds over fourfold difference in carbon footprints,19,Weight Loss Drugs,2.282086619987527e-19
10 minutes fat burning exercise in 30 days video credit goes to the owner and is taken from follow me and i will follow you back,6,Weight Loss Drugs,4.07889122326123e-14
friends do n't let friends run out of . so here your reminder ! head to your local today to stock up on the worlds first cereal with mcts and keto collagen !,19,Weight Loss Drugs,6.63508081810704e-10
. has confirmed there will be limited quantities of available at some local pharmacies from late next week . but gps are being asked to prioritise people with .,19,Weight Loss Drugs,1.1925686133062996e-11
the buzz around for weight loss is off the charts . so we did a deep dive on the . does it work ? who does it work for ? is it safe ? let get into it !,3,Weight Loss Drugs,5.956060089573612e-10
"this would not have happened if novo nordisk and drug companies in general werent constantly hunting for the next big weight loss drug . its the fatphobia and the capitalism , together .",3,Weight Loss Drugs,8.61198265478258e-11
the models are skinnier than ever has fashion stopped caring about body diversity ?,3,Weight Loss Drugs,1.0600529828629945e-23
health tips 1 . eat meat 2 . subscribe to my email newsletter where i tell you the same advice every week 3 . buy my products that are real organ meat and not at all just baby powder and pencil shavings 4 . only $ 399.99 plus tax,19,Weight Loss Drugs,1.8508477239720378e-07
successful weight loss is all about mindset . believe in yourself and your ability to make healthy choices . you are worth it !,3,Weight Loss Drugs,1.1154663279752501e-14
"the fact that one of the first responses to this tweet is someone saying the video is about me , looking at their profile and theyre a fatphobic edtwt . just really drives it home huh",3,Weight Loss Drugs,1.3292384970498006e-09
"pa degjoni ju shqiptare tralala lalala , se 'po thote erioni kombetar-e , tralala lalala . gjithe keto shemtira pas xhamise se et'hem beut i ka lejuar qe te mbulohet torre drin ! hahahahaha ! shqiperi shqiptar tirane albania albanian edi rama",19,Weight Loss Drugs,1.2229746744196746e-06
