text,community_id,community_name,perplexity
they are tainting the street ozempic supply with metformin and its causing metabolic acidosis we need to start distributing test strips,3,Weight Loss Drugs,9.785236314806268e-14
tiktoker remi bader reflects on the side effects from using ozempic,3,Weight Loss Drugs,4.305829871273112e-20
kyle richards shares workout & ; diet plan amid ozempic accusations hollywoodlife,3,Weight Loss Drugs,3.558391799118677e-25
this youtube essayist has her finger on the pulse much more than i do . i thank her for hepping me ozempic diet craze in hollywood . too bad it primarily meant for diabetics and there a shortage of the drug . -- & gt ; is 90s thinness coming back ?,3,Weight Loss Drugs,2.0952970771759283e-06
lota of random doctors note think they are weight loss experts telemedicine ? ethical ? or lane violation ?,6,Weight Loss Drugs,1.1694307335173505e-15
"unprocessed red meat in treatment of rct beef supplementation during weight maintenance after healthy ad lib diets or unprocessed beef had similar effects on body weight , metabolism , & ; cv risk in 3 mo post-weight loss",19,Weight Loss Drugs,8.00640549414311e-08
does the diet impact attacks ? learn what the evidence ( that we have ) says,3,Weight Loss Drugs,3.801399785660504e-22
"pslay off the sugar if youre a vegan , stay vegan if youre keto , stay keto your body will thank you but whatever you do , stay away from processed foods , sugar , & ; try to do all you can to erase gmos drink h2o , & ; if you must , a little wine nothing excessive . be well",3,Weight Loss Drugs,1.975088707695249e-06
weightwatchers prescription med move causes concern for those who need ozempic for type 2 diabetes,3,Weight Loss Drugs,7.7963489132893925e-19
"weight loss with ozempic or wegovy comes with a logical , but potentially jarring change in eating habits .",3,Weight Loss Drugs,3.1508092508225442e-15
"well holy fuck . `` in the case of the ozempic , an fda warning alerts to the development of thyroid tumors in rodents , and it can be dangerous for those who have ( or have a history of ) pancreatitis or a certain type of thyroid cancer . '' it me , ya girl who had pancreatitis",3,Weight Loss Drugs,2.3589466309204e-06
motivatedfit | your clear step-by-step guide to your dream body without struggle !,6,Weight Loss Drugs,4.2029594930975153e-19
you love to see it . thanks to the keto/carnivore warriors for speeding this process up .,19,Weight Loss Drugs,4.775664930243943e-16
"okay , what if i break a kit kat bar in half and put a reeces cup between it like a sandwich ? is that keto ?",3,Weight Loss Drugs,6.19135276901106e-13
"i think there some good points to be made here , but this section gets the order of events entirely wrong . wegovy was approved in june 2021 and demand was much higher than anticipated/factory problems , whicn then led to off-label ozempic spree .",6,Weight Loss Drugs,2.839594799297629e-07
"wow ! just had my first factor_ meal and it was absolutely incredible ! loved it ! keto jalapeo-lime-cheddar chicken with spicy cilantro cauliflower `` rice '' check them out , discount if you sign up",3,Weight Loss Drugs,1.301777103890345e-07
dietitians be sure and check continuing ed who are speakers ? what are their credentials ? are they supplement sellers ? promoting ? are they making claims ahead of research ?,6,Weight Loss Drugs,1.018292915266894e-11
a 'game changer ' weight-loss drug is making people disgusted by their favorite foods including coffee and chick-fil-a,3,Weight Loss Drugs,3.083069146118597e-14
new year ! new beginning ! please listen to & ; share ft & ; sharing tips & ; advice for healthy for people living with,6,Weight Loss Drugs,2.8947622022958835e-14
"why everyone is talking about ozempic you 've heard people talking about the drug for weight lossor is it diabetes ? if you 're confused , here what to know .",3,Weight Loss Drugs,1.8721103833829744e-10
coronation street sue cleaver wows fans as she shows off weight loss in new pic,3,Weight Loss Drugs,5.830063873017855e-21
i can not believe how many people in this town are casually taking ozempic when the side effects are * literal cancer * ? ? ? ?,3,Weight Loss Drugs,1.414891966609877e-12
watching this story about ozempic etc . is making me hope that this will finally get us affordable insulin .,3,Weight Loss Drugs,3.124594957533563e-16
the ultimate keto ninja foodi cookbook 1000 easy and foolproof keto recipes for everyone on a budget 2022 edition 2daf1qe,6,Weight Loss Drugs,1.1224227927306152e-12
"la escasez de medicamentos para la diabetes se ha afianzado en tanto que ms pacientes recurren a medicamentos como ozempic y wegovy para otros usos , como bajar de peso . pero los mdicos dicen que dejar de tomar estos frmacos puede pasar factura .",3,Weight Loss Drugs,2.3873153622844256e-06
"cucumber contains water in large amounts , thereby flushing out toxins from the system . this may help in the treatment of kidney stones .",6,Weight Loss Drugs,1.7645017662704793e-13
have a prescription for ozempic ? we can help . helps thousands of americans save up to 90 % on medication save 10 % on first order with code first10,3,Weight Loss Drugs,2.985819230749698e-11
diet culture and fatphobia fuckin suck . fda just approved diabetes med called ozempic for weight loss and theres literally a shortage of it now cause people wan na lose a little weight and diabetic are suffering as a direct result of this . my pal hasnt had their meds in weeks,3,Weight Loss Drugs,2.462864358676597e-06
making one tiny change to your evening routine can not only help banish belly fat it can also flatten your stomach faster than hundreds of crunches or hours of cardio .,6,Weight Loss Drugs,5.591804796978295e-11
"'keto-like ' diet linked to higher risk of heart disease , new research shows abc news",3,Weight Loss Drugs,4.864263302668601e-18
k i started eating kimichi again after not eating it for almost a year . it had nothing to do w keto . this week i pour kimichi juice over an avocado & ; its so good . so if you love kimichi & ; avocado give it a try .,3,Weight Loss Drugs,7.074207815094269e-07
"this is your sign to start say goodbye to fad diets , calorie counting & ; co. , and hello to healthy and sustainable weight loss take the leap and embrace a new way of life download bodyfast for free",3,Weight Loss Drugs,1.8122616296523123e-08
fuck . mounjaro wasnt covered & ; my appeal got denied im not t2 im still diabetic & ; honeymooning ! they wont put me on insulin & ; i cant afford $ 75 ozempic . i have to have my husband drive me an hour to & ; from my endo tomorrow for a 1 time coupon until i figure this out,3,Weight Loss Drugs,2.049316208285745e-06
facts ! left column is people defective . right is were they went to,6,Weight Loss Drugs,1.8859217542433043e-26
ozempic explained how weight loss drug works and what happens if you stop taking it,3,Weight Loss Drugs,1.3183572190153281e-22
"zero-calorie sweetener popular in keto diets linked to strokes , heart attacks",3,Weight Loss Drugs,1.197073810501721e-19
things ive learned in the last week dont take media at face value low carb and keto is an anti-business and anti-sweet food movement at heart be skeptical of doctors or researchers with brain dead personal biases,6,Weight Loss Drugs,1.1789845544285528e-08
"call ya mf stop taking life saving meds from people who actually need it ? diabetics and women with pcos actually need it . meanwhile the rest of you are causing a shortage , just for your dumb weight loss fad . you 're taking away something that others need .",3,Weight Loss Drugs,3.530382457483938e-07
23 keto ground pork recipes ( easy low carbmeals ),6,Weight Loss Drugs,4.042088519168828e-25
the male patient with undergoing -metabolic surgery changes in levels correlate with after oagb and rygb,6,Weight Loss Drugs,1.0679470808321024e-16
"in the new normal era like now , your access to best healthcare regardless of your location is very important to us .",3,Weight Loss Drugs,6.110406213637469e-16
el frmaco para diabticos que se est agotando en espaa por su popularidad como adelgazante es revolucionario y su efectividad ha disparado la demanda hasta un 6.000 % se observan prdidas de peso como no se haban visto antes,3,Weight Loss Drugs,1.4817652527199243e-06
"really , out of all the dumb stuff i 've seen american low status white male tradlarpers peddle , raw milk has to be the dumbest , even dumber than the keto diet . you 're exposing yourself to bodily fluids full of live viruses from other mammals . why do you think we pasteurize milk ?",3,Weight Loss Drugs,1.5797696732988695e-06
"its been nearly a year since novo nordisk revealed a supply shortfall for its obesity blockbuster-to-be wegovy . now , it appears history is repeating for the companys chief rival , eli lilly .",6,Weight Loss Drugs,4.494174810076856e-09
real housewives kyle richards addresses speculation she used ozempic for weight loss,3,Weight Loss Drugs,5.50893376987531e-23
fuck . i need to get on ozempic . is that covered by insurance ? not unless you have likediabetes . how do you get diabetes ?,3,Weight Loss Drugs,2.022052490724402e-11
"good morning , just a reminder , water is very essential for your organs . drink water , rest if you are tired and be happy .",3,Weight Loss Drugs,5.4416418745172063e-14
why is averagespo trending ? ? ? ? ? ? edtwt wtf,3,Weight Loss Drugs,1.6378785204899422e-20
urbaano naturals 100 % natural sonora california extra long almonds packed in pouch | premium badam giri | high in fiber & ; boost immunity | real nuts | gluten free ( 800 ),6,Weight Loss Drugs,1.399925841916172e-09
"amgen , seeking to crash novo party , links bispecific to weight loss months after end of dosing more like this |",6,Weight Loss Drugs,1.4833873875335498e-13
"ozempic , one of several brand-name drugs on the market meant to treat chronic conditions , has become a hot topic in conversations about weight loss everybody i know is on it .",3,Weight Loss Drugs,1.4584543295281804e-10
"craving pizza tonight ? no need to resist , just make sure to enjoy a few slices mindfully and balance it out with some healthy choices tomorrow .",3,Weight Loss Drugs,5.582666490547283e-13
"mchtest du traffic , mach einfach was zum thema . luft .",3,Weight Loss Drugs,3.1242562622278985e-19
"you sleep late , you wake up late , and you do n't expose yourself to you travel in an ac car , sleep in ac with a quilt , and take a hot shower bath . basically , you block any natural exposure to your body and then complain of a lack of body immunity .",6,Weight Loss Drugs,9.435053129891458e-07
ask your doctor if taking medicine away from diabetics so that you can lose weight is right for you !,3,Weight Loss Drugs,3.316154171707532e-17
"glp-1-ra/step1/ diab care bmi & gt ; 30dmhtnosacvbmi & gt ; 27 3,379glp-1-ra68egfr",3,Weight Loss Drugs,6.077742753518578e-09
this whole ozempic discussion makes me deeply uncomfortable on multiple levels . 1 . as a fat person who loves her body as is 2 . as a fat person who has to lose fat because she wants plastic surgery 3 . as a fat person on medication which will likely dramatically change her weight,3,Weight Loss Drugs,7.439954856636177e-07
"weight-loss drug semaglutide is debunking diet , exercise myths",6,Weight Loss Drugs,7.418660604354894e-21
"tomorrow :00am est join us as we visit with sandra elia , food addiction counselor matters a community of hope and support for your weight management journey . weight management beyond eating less & ; moving more",6,Weight Loss Drugs,2.8446116573377367e-09
"the type 2 drug , , has become a household name for because of social media . silvana obici , md , weighs in on what you should know about this dangerous trend .",3,Weight Loss Drugs,4.477930179436207e-11
"of ? clean fasting = just water , tea , black coffee the result ? higher fat burning quicker breakdown of metabolic by-products increased cell cleansing more efficient metabolism try it for 2 weeks , feel the difference !",3,Weight Loss Drugs,2.53692622464996e-09
"the keto diet is the worst diet for both your body and the earth , researchers say",3,Weight Loss Drugs,8.298058123986325e-20
"data from mice and monkeys demonstrates the promise of poly-pharmaceutical approaches , here a dual glp-1/gdf15 molecule , in metabolic drug discovery and development",6,Weight Loss Drugs,1.9994634420372748e-11
"riddle whats creamy , sweet , , and has 1000+ 5 star reviews ? ! keto cheesecake snacks of course ! from type 2 diabetics to people looking to satisfy their sweet tooth in a cleaner low-carb way , they 're for everyone !",19,Weight Loss Drugs,1.657095083373861e-07
"you may know her as , but caitlin is also an when it comes to managing through lifestyle change ! take your health into your own hands , like caitlin , in 2023 with our * new * bundles",19,Weight Loss Drugs,1.2179899311348663e-09
"hrom rn keresztl csinltam keto hsgombcokat , illetve meatball sub szendvicset bellk -nak s a vgre mr egyltaln nem bntam hogy nem mentem szakcsnak",3,Weight Loss Drugs,3.793150256115041e-07
i get indoors for two second and open my coat to reveal mine midriff and touches my bare stomach ca n't believe she been a tummy anon all this time,3,Weight Loss Drugs,1.3903535267534295e-10
on keto . go to maccas with kids . opt for the $ 11 chicken and salad . major regrets . wo n't do that again .,19,Weight Loss Drugs,1.8883720542123283e-12
diabetes drug ozempic in short supply as more americans use it to lose weight,3,Weight Loss Drugs,2.303933275836555e-22
"keto & ; fasting health easy 5 steps to a healthier you kindle edition forget diets , apps , calorie counting we show you how to change what you eat & ; when you eat & ; lose weight the safe way i 've lost 50 lbs in 6 mths tap link below take a look",3,Weight Loss Drugs,1.6595283796050353e-06
", a drug mainly used to treat type-2 , is the safest available medication for , a uae-based doctor says , but advised that people should consult with a doctor first .",3,Weight Loss Drugs,2.0231145925198035e-10
do n't be tricked by diet culture ! enjoy your halloween treats !,6,Weight Loss Drugs,5.5000695765416136e-24
i am volunteering for the leftist jordan peterson position . qualifications -abused substances for over a decade -could get future spree shooters to read jacques ellul instead of airholing a wegmans -it is always nice to talk to people -diet is keto+bread -also a gamer,3,Weight Loss Drugs,1.264758452634851e-06
if you dont think im asking my doctor about ozempic next week . looool,3,Weight Loss Drugs,3.7256194109873053e-19
"duke e shpallur rusin si shtet sponzor t terrorizmit , eurodeputett po prgatitin terrenin q presidenti rus vladimir putin dhe qeveria e tij t prgjigjet pr kto krime para nj tribunali ndrkombtar .",3,Weight Loss Drugs,1.217073418047221e-06
eating disorder experts are worried about diabetes drugs like ozempic being used for weight loss,6,Weight Loss Drugs,1.3169361586697758e-20
"keto & ; fasting health easy 5 steps to a healthier you kindle edition forget diets , apps , calorie counting we show you how to change what you eat & ; when you eat & ; lose weight the safe way i 've lost 50 lbs in 6 mths tap link below take a look",3,Weight Loss Drugs,1.569013193147839e-06
"livlo keto biscuit & ; bread mix low carb & ; gluten free baking mix 2g net carbs fast , easy and delicious keto friendly fo cwxxzac",3,Weight Loss Drugs,9.416672996920283e-10
let keto bhb capsules reviews real ketosis weight loss results or scam ?,6,Weight Loss Drugs,3.0082951046237967e-19
"similar to younger women , womens dissatisfaction with their body was linked to pathology read the full story here",6,Weight Loss Drugs,6.7616096598927196e-18
going keto is easy with these low-carb recipes .,3,Weight Loss Drugs,7.591351009757681e-27
thanks to for including my nutrition expertise and insights in this piece on low calorie veggies for . read more here and happy veggie time,6,Weight Loss Drugs,1.981882756865727e-12
"lions mane , garlic , heavy cream , and sea salt omelet , with farm fresh bacon .",3,Weight Loss Drugs,8.660470507270241e-20
not siri referring to ozempic as mozambique . wheres my mozambique i absolutely can not function without my mozambique !,3,Weight Loss Drugs,3.358448789930096e-15
can yall ozempic ? people have diabetes and yall are taking it all to get rejected from modeling shoots,3,Weight Loss Drugs,6.092460761858702e-16
emily ratajkowski bares ample cleavage and taut midriff in saucy revealing dress,3,Weight Loss Drugs,8.502852663264942e-19
"never skip breakfast kiwis are high in vitamin c and dietary fibre . they can support heart health , digestive health , and immunity . the kiwi is rich with vitamins and antioxidants .",3,Weight Loss Drugs,3.493390687836495e-09
"new podcast ! `` get fit , get fabulous-your ultimate weight loss solution '' on",6,Weight Loss Drugs,5.607578864649443e-19
dolly parton claps back after fake keto and gummy ads featuring the country music icon circulate on social media,3,Weight Loss Drugs,1.2172692697299658e-14
try to incorporate these diet hacks into your daily lifestyle to effectively deal with stubborn belly fat,3,Weight Loss Drugs,3.1878199870472556e-20
fun fact not only is name brand adderall on nationwide back-order .... diabetes drug ozempic i was just told is also on nationwide back-order as well . so here hoping i can get a doc to change both of my prescriptions .,3,Weight Loss Drugs,1.738360566605479e-07
best diet pills for women top 7 female weight loss supplements on the market,3,Weight Loss Drugs,9.16367057129826e-25
please can you inform your viewers is not a it is more valuable because of the gain ! ! it is a treatment for the disease of not for people who want a summer body,6,Weight Loss Drugs,5.883377812709867e-11
"understand influences on appetite and weight , , overcoming biologic adaptations to through nutrition plans and more .",6,Weight Loss Drugs,1.498457195932387e-19
robert pattinson was all for keto . . . until he realized he could n't have beer .,3,Weight Loss Drugs,1.1113235222557092e-17
a patient was so mad they couldnt get their ozempic and asked me what are they supposed to do to lose weight . i told her to eat a salad and go for a run,3,Weight Loss Drugs,5.364855226730467e-10
leni klum bares her toned midriff in a crop top and low-rise jeans during a photoshoot on the streets of nyc,3,Weight Loss Drugs,7.792388154008456e-13
"fellow and followers ! if your gums get a little enflamed from not brushing your teeth and not getting enough vitamin c ( right ? ) just rub a teaspoon of baking soda on your teeth and swish some vinegar ( dont swallow , its a plant product )",19,Weight Loss Drugs,3.859926778204681e-07
$ nvo faster near-term glp-1 market growth in t2d and more stable ozempic market share boosts novos 2022-2025 revenue cagr to 16 % ( prev . 11 % ) and eps cagr to 20 % ( prev . 16 %,6,Weight Loss Drugs,1.3928208772995276e-06
"the weight-loss drug wegovy may be effective in teens just as it has been shown to be in adults , a new study suggests",6,Weight Loss Drugs,1.1703845900247478e-13
photo rhoc star shannon beador shows off major weight loss & ; denies using ozempic after john j,3,Weight Loss Drugs,8.84181747678065e-16
the makers of ozempic and wegovy have finally made it possible for all these hollywood types to binge then purge but out of their asses that all this is .,3,Weight Loss Drugs,3.048544403028153e-11
glp-1r agonists for weight loss approved and in clinical trials . are glp-1 weight loss drugs the next blockbusters ?,6,Weight Loss Drugs,1.906645197627399e-12
"have you taken ozempic for weight loss ? ajc reporter shelia poole would like to speak to you about your experience , and if youre having trouble getting a prescription filled due to the recent shortage . please reach out to her email at spoole.com",3,Weight Loss Drugs,2.560789198469138e-07
"superfood smoothie powders can provide a convenient and nutritious way to supplement your diet with vitamins , minerals , and antioxidants , helping to support overall health and well-being .",6,Weight Loss Drugs,4.032980616130999e-09
"other than viagra and botox , ive seen no other medication so quickly become part of modern cultures social vernacular .",3,Weight Loss Drugs,3.898574171823377e-15
"i swear , the happiest part of the day is when im eating .",3,Weight Loss Drugs,2.785421155769804e-22
the essentials of fasting for more tips to boost your fasting success download the for free,3,Weight Loss Drugs,7.401990556254737e-19
novo nordisk is delaying introduction of its wegovy obesity treatment in europe until next year to make sure it has enough supply after the us launch was marred by production bottlenecks and drug shortages,3,Weight Loss Drugs,5.84909842782366e-10
"t gjith n protest dhe shoqria duhet t reflektoj fort , jo indiferente ! t largojn qeverin rilindje kancerogjene q metastazat e saja jan prhapur gjithandej . me mijra skandale i kan ndodhur ksaj qeverie n keto 10 vite , kanabizua gjith shqipria asnj ambasador",6,Weight Loss Drugs,2.162283180950908e-06
the lack of supply of this for diabetes has a big impact on my health tga investigates influencers after diabetes drug ozempic promoted as weight-loss treatment,19,Weight Loss Drugs,1.5243818360377578e-11
"whenever i go to try and make some keto recipe , it always has some oddball ingredient that i do n't have and ca n't afford . not to mention , it always eggs , eggs , eggs . again , ca n't afford it .",3,Weight Loss Drugs,1.196365388977938e-07
"las alternativas keto a postres como brownies y pan saben todas a cartn y nadie me va a convencer de lon contrario , es como ese sabor a pan integral pero peor",3,Weight Loss Drugs,8.058895417661915e-08
its so annoying seeing everyone gaslight kyle saying she has had ozempic when she has said multiple times she hasnt,3,Weight Loss Drugs,4.8925944404806104e-15
i dont think the ozempic article author did anything wrong ! & ; i dont think they needed to come out and say that the subjects answers were worrying the subtext was there !,3,Weight Loss Drugs,1.5219372428987299e-09
consumers in search of a get-thin-quick solution are buying up compounded semaglutide injections of uncertain provenance . it makes you wonder how the heck are you guys getting this ?,3,Weight Loss Drugs,1.8599638496041846e-09
every time i see a tweet about people using ozempic for weight loss i think about my dad who uses it he * actually * needs it,3,Weight Loss Drugs,7.802266645262623e-12
i tried to get semaglutide myself from sequence . heres how it went .,3,Weight Loss Drugs,6.649924664164e-19
"88 % of you were wrong . results from the step 1a trial show that `` in the semaglutide group , weight loss was observed from the first postrandomization assessment ( week 4 ) onward , reaching a nadir at week 60 '' . that means weight regain started at week 60 .",3,Weight Loss Drugs,2.107531827277853e-06
treatment with semaglutide reduced bmi in adolescents with obesity,3,Weight Loss Drugs,3.5124169855623964e-25
"growth of brain cells is independent of age ! promote the growth of your cells by indulging in , , and .",6,Weight Loss Drugs,1.963492251953617e-15
i have a patient with constipation and nausea issues with semaglutide . any reason to believe that dulaglutide would be any different ? thanks,6,Weight Loss Drugs,2.498254554617052e-11
keto vs. vegan study of popular diets finds over fourfold difference in carbon footprints,6,Weight Loss Drugs,2.8068771424550173e-18
caution it will mess with hormones and other severe side effects . wife started it and now developed diabetes . is it from ozempic ? look very close before docs prescribe .,3,Weight Loss Drugs,1.7821262521255932e-10
new podcast ! `` best ways to lose weight '' on,6,Weight Loss Drugs,1.2490362120454826e-26
"alex murdaughs trial continues , emts were fired after failing to treat tyre nichols , and ozempic face is the tip of the side effects iceberg .",3,Weight Loss Drugs,3.6873532005543546e-11
"it is true that blood group is related to and many other kinds of diseases , '' said sohini banerjee , dietitian , fortis hospital & ; kidney institute , kolkata |",3,Weight Loss Drugs,6.044721390097152e-10
milk thistle helps reduce insulin resistance and thus improves glucose uptake from the blood . this helps in managing diabetes and its associated complications . try our milk thistle seed powder !,6,Weight Loss Drugs,1.0120927533552315e-11
healthy lifestyle will allow you to live in freedom to do and wear what you want . think about it .,19,Weight Loss Drugs,3.4209242063490086e-17
experience immediate migraine relief discover how to manage your migraines now !,3,Weight Loss Drugs,6.6955721067555e-24
"teaki hut monk fruit extract , 4oz , organic powdered monk fruit sweetener with no erythritol or xylitol , paleo , keto , & ; vegan mjxi16b",3,Weight Loss Drugs,8.657925043564774e-09
"amazon deal found optimum nutrition amino energy drink + electrolytes for hydration sugar free , amino acids , bcaa , keto friendly , sparkling drink blueberry lemonade , pack of 12 ( packaging may vary ) price $ 11.93 clip coupon",3,Weight Loss Drugs,2.277461135236081e-07
"dolly parton declares she 'more the cake , cookie , and cornbread type ' after fake keto and gummy ads featuring her",3,Weight Loss Drugs,1.8347633525331308e-13
mum-of-two reveals `` wonderful '' side effects of weight loss injections,3,Weight Loss Drugs,8.686244291934657e-20
there a way to improve your health and footprint without giving up meat entirely . '' and why not include the sentience of animals in the equation ?,19,Weight Loss Drugs,4.824472418785142e-12
"this past year was full of news regarding anti-obesity medications , such as semaglutide and tirzepatide . find out what other stories topped headlines in 2022 .",6,Weight Loss Drugs,2.708574475818182e-10
