text,community_id,community_name,perplexity
"ever find yourself emotional eating ? set yourself up for success by putting together a toolbox , outlined on my dr. francavilla show podcast episode , `` how to know if you 're emotionally eating & ; what you can do ''",6,Weight Loss Drugs,6.81643115285624e-08
"amazon deal found quest nutrition mint chocolate chunk protein bars , high protein , low carb , gluten free , keto friendly , 12 count price $ 13.49 clip coupon",3,Weight Loss Drugs,7.751171926528855e-11
game-changing wegovy weight loss jab to become available on nhs,3,Weight Loss Drugs,2.39252314435378e-23
amanda holden flashes her toned midriff in a cream top and skirt,3,Weight Loss Drugs,1.8077485228085867e-24
"the more things change , the more they stay the same ! down 125 pounds with !",3,Weight Loss Drugs,3.3445666741582207e-21
loved our keto greens for the nutrition but not the taste ? super reds is for you super reds is a low-calorie juice-like drink blend with a powerful burst of fruit flavor to support your keto lifestyle . set up your pre-order and save 30 % !,19,Weight Loss Drugs,6.036302693246398e-07
"i just bought keto honey . keto . honey . i dont know what it actually is , and i dont care .",19,Weight Loss Drugs,7.214244663895225e-14
"`` people need it for medical conditions , and pharmacies are out of it . ''",3,Weight Loss Drugs,2.5392093544486768e-18
"this week bs reduces cost of meds , half of the world will be living with overweight & ; obesity by 2035 , reporting of adolescent bs increases obesity stigma , low incidence of be after bs , nice recommends semaglutide for nhs and more",6,Weight Loss Drugs,6.20349638325024e-08
once-weekly semaglutide in adolescents with obesity ( step teens ) | nejm $ novob,6,Weight Loss Drugs,8.69139018252535e-18
star kyle richards calls the ozempic weight-loss rumors `` frustrating '' after how hard she has worked on her fitness . full interview,3,Weight Loss Drugs,1.4210474160239461e-12
join the aspc nutrition working group next journal club with and discussing -carb diets in for ! !,6,Weight Loss Drugs,5.962961732671035e-17
"keto & ; fasting health easy 5 steps to a healthier you kindle edition forget diets , apps , calorie counting we show you how to change what you eat & ; when you eat & ; lose weight the safe way i 've lost 50 lbs in 6 mths use the link below take a look",3,Weight Loss Drugs,2.157168864869164e-06
tga investigates influencers after diabetes drug ozempic promoted as weight loss treatment,3,Weight Loss Drugs,6.738961791570935e-22
balance your physical & ; mental health to live your best life .,6,Weight Loss Drugs,9.770792653468563e-27
once-weekly semaglutide in adolescents with obesity | nejm,6,Weight Loss Drugs,2.98497792831774e-25
interesting article on widespread glp1 ra use i miss eating the truth behind the weight loss drug that makes food repulsive,3,Weight Loss Drugs,7.732178375493507e-16
"if you have/had an unhealthy relationship with food , an eating disorder , or anything resembling it , i suggest you not read that ozempic article from the cut !",3,Weight Loss Drugs,4.426708166693771e-10
"coming up the surging popularity of the drug ozempic has caused a major shortage across america , but what does it mean now that some independent pharmacies are choosing not to stock the drug at all ? joins the next .",3,Weight Loss Drugs,1.1789845544285528e-08
"found your discussion of keto and mental health super interesting on the huberman podcast , and have bought the book for further reading . do you still follow a keto diet ? curious if it a lifestyle for you .",3,Weight Loss Drugs,3.183372010440166e-09
"although gastrectomy is the most predominant procedure performed worldwide , efficacy is not superior compared to considering and comorbidity resolution up to 5 years follow up .",6,Weight Loss Drugs,2.600718598810836e-11
someone on reddit just accused the selling sunset girls of injecting ozempic as if we didnt see heather order water for lunch,3,Weight Loss Drugs,1.84875877627666e-13
"nutrition content is huge on tiktok , but a new study shows trends like may influence disordered eating behaviors",3,Weight Loss Drugs,4.783539491152101e-17
. ' i would rather have a few extra pounds than shoot myself up with medicine ',3,Weight Loss Drugs,1.3589684044561202e-20
"`` i cant stand the way i look and how i look in clothes , its all i think about and im always checking myself in the mirror , if i could just lose weight i wouldnt worry as much . ''",3,Weight Loss Drugs,1.4837731043826352e-08
keto-style bush food diet could be key to helping indigenous australians to manage type 2 diabetes,19,Weight Loss Drugs,2.0364541738671691e-19
giving myself a break today . i am going to break my fast early and have a yum breakfast ! 15:9 today !,6,Weight Loss Drugs,2.5903319965473468e-15
kyle richards showcases ripped abs after debunking use of diabetes medication ozempic to lose weight,3,Weight Loss Drugs,1.900525212318161e-18
stellar body image is a prerequisite to eating disorder recovery . im busting this and other body image myths in this article,3,Weight Loss Drugs,2.0271082379406773e-14
fit for golf podcast with a true expert in the field of nutrition . fat loss muscle gain can we do both at the same time ? whats the deal with keto & ; fasting ? is a calorie a calorie ? listen here,6,Weight Loss Drugs,8.502592407921838e-08
"zero-calorie sweetener popular in keto diets linked to strokes , heart attacks",3,Weight Loss Drugs,1.463316314613844e-18
"dry skin on the penis can be painful or uncomfortable for some , but it can be avoided by numerous ways !",6,Weight Loss Drugs,8.604501476621555e-17
"`` keto will cure your diabetes '' my brother in christ , there are carbohydrates in broccoli . and when you stop eating carbs , your body just takes it from protein , destroying your kidney/liver and muscle mass .",3,Weight Loss Drugs,1.0866085631278113e-07
it is tonight .. do not miss this encounter with golda naa adaku addo on about her journey,6,Weight Loss Drugs,1.0858085704699722e-15
cardiologist dr steven lome has begun doing facebook lives and we 're adding those events and other content to our youtube channel . check them out ! ! ! wfpb hearthealth,6,Weight Loss Drugs,5.952414672272255e-10
"tw ozempic/body image there pop culture journalism about ozempic as a trendy fad . but what we need is reporting about two separate issues are people who need it getting it , and how many people who do n't need it are using it to enable disordered eating ?",3,Weight Loss Drugs,2.0319901068432955e-06
"what have you asked santa for ? sticking to your health goals can be difficult during the christmas period . visit our website for tips , resources and more",6,Weight Loss Drugs,2.0289583273040699e-13
prescribe fit has helped many patients reduce their insulin and even reverse pre-diabetes !,6,Weight Loss Drugs,4.955391057180136e-21
"french authorities have announced 'enhanced surveillance ' for , an anti-diabetic drug being misused for weight loss .",3,Weight Loss Drugs,1.951559251792698e-15
"in an international phase 3a clinical trial , adolescents with who received once-weekly semaglutide compared to placebo had a 16.1 % decrease in their body mass index ( bmi ) while the of those who took placebo rose by 0.6 % .",3,Weight Loss Drugs,2.7202145247429144e-07
"this sunday the is all about self-love and , as speaks with model kelvin davis . airs from 11am to 12pm et only on",3,Weight Loss Drugs,2.972831128402603e-13
intermittent fasting may not be as helpful for losing weight as once thought study,6,Weight Loss Drugs,4.250073915501644e-25
hailey bieber flashes her toned midriff in sheer cropped shirt while modeling tiffany jewelry,3,Weight Loss Drugs,5.87949251904123e-20
"ozempic shortage stronger advertising regulations and other loss options are needed , say researchers",6,Weight Loss Drugs,1.0229110133080374e-21
recommends more fillers to fix ? wasnt ozempic face originally seen in who have fillers and then lost ?,6,Weight Loss Drugs,2.005222388891284e-15
"take a quiz find out more about keto & ; fasting to improve your health [ i 've lost 50 lbs by not dieting , not counting calories , not constantly worrying what i eat ] see for yourself or get my life changing 19 p guide free .......",3,Weight Loss Drugs,9.33421517856914e-07
how use of ozempic for has led to a shortage 'let the diabetics have their drugs ',6,Weight Loss Drugs,3.6941227059106124e-16
"skip the diet fads and choose a healthy , tasty lifestyle that good for animals , humans , and the planet . ( you know the one . )",19,Weight Loss Drugs,8.290719673287317e-12
"new podcast ! `` atkins diet-all the stats , facts , and data you 'll ever need to know '' on",6,Weight Loss Drugs,2.568772255182647e-15
here are some of the best foods you can eat if you 're following the keto diet .,3,Weight Loss Drugs,4.0236112266595335e-18
the fact that people are resorting to nontraditional pathways to get medications which may be risky speaks to their desire for better health .,3,Weight Loss Drugs,9.742366283279832e-14
the tiktok trend that triggered a diabetes drug shortage you do not want to miss this episode .,3,Weight Loss Drugs,7.724092618831352e-18
"one of the rarest in world only 1 in 10,000 people on the indian subcontinent and 1 in 4 million people worldwide have the bombay phenotype . read more",6,Weight Loss Drugs,5.2055190019606457e-11
hollywood abusing semaglutide ? new weight loss medicine guidelines ? new bariatric surgery indications ? new podcast with me and,6,Weight Loss Drugs,4.6350195139236924e-14
for my colleagues step program nice review dose easclation of semaglutide,6,Weight Loss Drugs,4.0312715815224994e-21
ive done 11 days straight of fairly hard exercise so im guna give myself easy targets for a couple of days .,3,Weight Loss Drugs,5.575297066736946e-15
losing weight without counting calories ? possible find out why is the perfect alternative to traditional diets and how to learn,3,Weight Loss Drugs,4.825604404627281e-16
staying away from certain sections in the grocery store can be a simple way to eat healthier and lose weight . tune in for details behind dr. kim second weight loss tip .,3,Weight Loss Drugs,7.275291480368651e-11
finally read it and that ozempic article is dark and frankly framed irresponsibly,3,Weight Loss Drugs,7.442677502634689e-19
a nutritionist breaks down how ( and why ! ) to work carrots into the keto diet,3,Weight Loss Drugs,9.667429390932808e-19
"nextmed , a telehealth provider of drugs like ozempic prescribed for weight loss , has surged as it runs fake testimonials and controversial ads",6,Weight Loss Drugs,1.0965437759191676e-11
"it officially 2023 ! you know what that means ? ! get ready for new years resolutions . everyone is focusing on being their best , healthiest self . we will be sending out an email to our practitioners to show them how they can help .",6,Weight Loss Drugs,5.2141121642534927e-08
"keto baking cookbook 2022 the definitive guide to learn all the best tricks for low-carb , no-sugar baking with 100+ tested r fm03rz5",3,Weight Loss Drugs,7.151305242425465e-11
"obesity is not a choice . obesity is a complex , chronic , neuro-metabolic disease with a clear pathophysiology , said dr. ania jastreboff , an physician-scientist at yale university and guest .",6,Weight Loss Drugs,5.703995498151927e-08
"random-effects meta-analyses found in context of energy reduced , distributing intake with a focus on earlier intake resulted in significantly greater . improvements in homa-ir , fasting glucose , and ldl cholesterol were also seen .",6,Weight Loss Drugs,1.971669050249148e-08
here are the celebrities whove discussed hollywoods ozempic and weight loss drug trend,3,Weight Loss Drugs,3.732885158692818e-21
"i remember looking in the mirror , and it was almost like i didnt even recognize myself . my body looked great , but my face looked exhausted and old .",3,Weight Loss Drugs,1.690168317802776e-11
"tonight i was part of a panel on weight and health . takeaways -for physical health , add veggies ( probably ) -pay attention to your mental healthit matters",3,Weight Loss Drugs,1.1262067667328067e-10
i am pretty new to . is it always that when you politely ask a for the evidence they block you ?,19,Weight Loss Drugs,1.1113235222557092e-17
new year ! new beginning ! please listen to & ; share ft & ; sharing tips & ; advice for healthy for people living with,6,Weight Loss Drugs,2.0642684203696707e-14
"week one wegovy 5 pounds , not bad ! pushing on when i have real result pics ill post body for yall but im not doing face pics anymore",3,Weight Loss Drugs,5.5545017370317584e-12
"hi . i need ozempic to live . stop using it for your fucking vanity-laden panic attack about your 30th high school reunion , karen ,",3,Weight Loss Drugs,3.4190478139656255e-12
glucose monitors for weight loss ? does insulin and glucose affect weight loss ? do they help ?,6,Weight Loss Drugs,2.3897629175220568e-20
keto diet for women cookbook over 50 over 500 simple and mouthwatering recipes with a 28 day-meal plan for women undergoing ggek2u3,3,Weight Loss Drugs,1.061184213418942e-11
"`` people need it for medical conditions , and pharmacies are out of it . ''",3,Weight Loss Drugs,3.86259679811333e-18
please dear god all i want for christmas is my ozempic to be refilled,3,Weight Loss Drugs,6.122666170790774e-20
"`` i do n't usually write reviews , but i had to share my experience with . in just two weeks , i 've noticed a major difference in my energy levels and overall weight . highly recommend giving this one a try . ''",3,Weight Loss Drugs,5.838225547449839e-08
and developed once daily glp-1 combinations that never gained traction . will once weekly semaglutide icodec combinations become a useful option for some,6,Weight Loss Drugs,9.439483916739988e-12
what is ozempic face ? doctors warn about facial ageing side effect of diabetes medications,3,Weight Loss Drugs,7.149335605227743e-20
"like everyone with eyes and a brain , jeff lewis thinks kyle richards abused diabetes medication ozempic for weight loss",3,Weight Loss Drugs,2.1903741296915195e-16
some patients who use diabetes drugs like ozempic and wegovy for weight loss have reportedly noticed facial aging and sagging .,6,Weight Loss Drugs,3.0974094139156125e-14
can supplementing with juvenescences metabolic switch replace a keto diet ? richard investigates .,19,Weight Loss Drugs,1.2154571241338877e-18
amazon deal found atkins meal size creamy chocolate protein-rich shake . with protein . keto-friendly and gluten free . ( 12 shakes ) price $ 14.96 clip coupon,3,Weight Loss Drugs,3.915074930915807e-10
another successful day of keto people spouting shite . got blocked by the baldest doctor ever for suggesting he was a grifter . someone conflated carbs with cyanide . and tim noakes tried to pretend low carb is better for performance than high carb . goodnight,19,Weight Loss Drugs,1.4538011328113498e-06
"`` ive seen women on instagram that im pretty convinced are all taking that hollywood [ drug ] ozempic because their weight loss is so dramatic in a short period of time , '' katie couric says in intv",3,Weight Loss Drugs,3.467945575152953e-08
stay happy and healthy abroad from the right shoes to shorts and seatbelt extenders,3,Weight Loss Drugs,5.1550891379875965e-22
drug used to treat type-2 diabetes is in short supply due to increased demand linked to people trying to lose weight following a viral trend in 2022 .,3,Weight Loss Drugs,5.341305089195947e-12
existe la dieta keto para vegetarianos ? abro hilo ( porque s que me sigue gente vegetariana ),6,Weight Loss Drugs,3.41212111733616e-13
"amazon deal found atkins gluten free protein-rich shake , milk chocolate delight , keto friendly ( pack of 12 ) , 11 fl oz price $ 11.99 clip coupon",3,Weight Loss Drugs,1.5760148741605915e-10
diabetes medication used for weight loss leads to shortage of medication for diabetic patients,19,Weight Loss Drugs,1.9899522467356813e-22
"a tiktok trend has turned a drug intended for type 2 diabetics into a sought-after weight loss aid . but now diabetics cant access their medication , writes in todays infodemic newsletter .",3,Weight Loss Drugs,1.1412669032040412e-08
"forget keto , y'all need to hop onto the 'prison diet ' . this is the el chapo sh00ter and look how prison transformed his physiognomy .",3,Weight Loss Drugs,5.835347760552168e-10
"as midriff exposure has become almost humdrum , a new style is emerging the belly-button-focused diamond-cutout dress .",3,Weight Loss Drugs,5.027891623009262e-13
cardiologist dr steven lome has begun doing facebook lives and we 're adding those events and other content to our youtube channel . check them out ! ! !,6,Weight Loss Drugs,4.62185281366323e-12
looking for ways to boost your with ? secret tip download the personalized fasting plans daily coaching effective challenges,3,Weight Loss Drugs,1.018750183028266e-17
i can see why ozempic replaced adderall in hollywood- it makes you skinny without the pesky side effect of making you work harder,3,Weight Loss Drugs,6.562161838224999e-13
"nothing more tragic than finding a funny tweet , only for the author to be on edtwt",3,Weight Loss Drugs,1.0142404770466882e-17
ozempic goes way off-label | american council on science and health american council on science and health,3,Weight Loss Drugs,8.988861701592282e-18
gon na be sad if i lose my muscles after this keto cut,3,Weight Loss Drugs,1.597940157670657e-23
"amazon deal found atkins snack bar , caramel double chocolate crunch , keto friendly , 7.76 ounce ( pack of 1 ) price $ 5.94",3,Weight Loss Drugs,7.1718724709013415e-12
"sweet tooth ? there is no sweet tooth . you mentally restrict sugars which makes them more appealing . the problem is n't your sweet tooth , the problem is your mental restriction of sugar . stop restricting sugars and watch what happens",3,Weight Loss Drugs,2.005627486312278e-08
"semaglutide is not a weight loss drug , it is a treatment for the disease of obesity . go slow because having side effects doesnt increase the effectiveness of the drug in the long term .",6,Weight Loss Drugs,4.653899932094418e-09
easy peasy blueberry lemon muffin recipe | youtube live | gluten free + paleo,3,Weight Loss Drugs,1.0380034735299278e-17
"eat what you love and still lose weight * * as long as its keto , no more than 800 calories every 24 hours and you also have to fast for hours on end , ie starve yourself .",6,Weight Loss Drugs,2.389270559177703e-09
"dear social media & ; news outlets please stop calling ozempic & ; wegovy hollywood/celebrity weight loss drugs & ; recognize that these are evidence based medical therapies for chronic diseases like diabetes & ; obesity , used in conjunction with healthy lifestyle habits .",6,Weight Loss Drugs,2.484211449882423e-07
"the artificial sweetener called erythritol is often found in diet foods , such as truvia , as a sugar replacement because it does not affect blood glucose levels and does not have any calories .",3,Weight Loss Drugs,2.5069541997879684e-09
what is aortic stenosis ? how do you treat aortic stenosis ?,6,Weight Loss Drugs,5.521501674625351e-20
has anyone tried the weighted yoga bracelets ? they 're like 80 bux so i was wondering,3,Weight Loss Drugs,1.0746608922738889e-17
"if you 've been wondering about the new weight loss drugs all over the internet right now , this new video explains how they work -- and talks about more drugs on the way soon .",3,Weight Loss Drugs,4.705345002520287e-10
"from infomercials to fad workouts , americans have been looking for quick methods for weight loss for decades . dives into the latest trend -- taking medicines like ozempic and mounjaro typically known for the treatment of diabetes . stream the episode on .",3,Weight Loss Drugs,6.030767281117733e-07
ketogenic diets found to undermine exercise efforts and lead to muscle shrinkage and bone loss . even keto diet advocates call bodybuilding on a ketogenic diet an oxymoron . keto diets muscle growth and bone density |,19,Weight Loss Drugs,6.419818987524195e-08
tiktok convirti una inyeccin para la diabetes en un medicamento para bajar de peso,3,Weight Loss Drugs,1.8657328760825042e-14
"while ozempic has surged in popularity this year , theres another diabetes drug and weight loss agent on the rise . reports",3,Weight Loss Drugs,1.2003188699059864e-14
"done ! ! several times ! ! remember you are the most important one , so look after yourself . be who you are not who you think you should be ! be good to yourself , because you are absolutely worth it .",19,Weight Loss Drugs,6.656849294017775e-09
a diabetes medication unlikely tiktok fame has led to a four-month-long shortage as celebrities and others embrace ozempic for weight loss . that created very real issues for patients with diabetes,3,Weight Loss Drugs,7.478200281241241e-10
"a 'miracle ' obesity cure , or dangerous tiktok trend adored by hollywood ? as likes of elon musk , jeremy clarkson and chelsea handler spark craze for slimming jab , experts warn ozempic benefits may not outweigh risks",3,Weight Loss Drugs,1.712861603664351e-07
"the girlies are all on ozempic and its triggering me . even my baby d * mi , i think /",3,Weight Loss Drugs,4.68567191476291e-16
obsessed with him tying his scarf around her bare midriff to keep her warm,3,Weight Loss Drugs,3.7116266573398844e-22
"in a recent article , franchell hamilton md , facs , fasmbs , dabom , discusses how a patient brain can affect their weight loss journey . read the article at",6,Weight Loss Drugs,1.7499247884078528e-10
the number of my followers who vacation in other countries so that they can purchase & gt ; $ 1000 worth of semaglutide in other countries is staggering .,6,Weight Loss Drugs,2.8947500646525622e-11
"the recent surge in popularity of ozempic , a drug used for weight loss , has also led to the discovery of an undesirable side effect a gaunt-looking face .",3,Weight Loss Drugs,3.3152933176516797e-10
"do you already know our products ? if you have any questions , we will be happy to answer them in the comments !",19,Weight Loss Drugs,1.6485262268906573e-15
2/21/23 -phase 2/wk 7/day 2 lean schedule,6,Weight Loss Drugs,8.209516355789481e-21
"are you permanently tapering diabetics off ozempic because of a temporary , man-made supply issue ? no ? then why are you force-tapering stable pain patients ? . restore our safe , legal meds .",3,Weight Loss Drugs,1.5726264734894357e-08
", has gained a lot of attention in the media lately . , adas chief scientific and medical officer told , the medication can also reduce the risk of cardiovascular disease for people with diabetes . read more .",6,Weight Loss Drugs,9.181743698682963e-10
findings suggest that is a feasible approach to protect oocytes against advanced maternal age-related oxidation damage and to improve the reproductive outcomes of aged females .,6,Weight Loss Drugs,6.845873152215576e-13
unsure if you qualify for glp-1 meds like saxenda and wegovy ? i 've got you covered !,3,Weight Loss Drugs,3.2718721124352235e-14
rita ora flaunts her chiselled midriff in an unbuttoned shirt after filming for the jonathan ross show,3,Weight Loss Drugs,4.6421681331853405e-14
find us near you ! your favorite snacks are on shelves at local grocers across the usa ! out store locator just got a major upgrade so head to our site to find perfect keto and superfat products in your neighborhood .,19,Weight Loss Drugs,1.9029107178880625e-08
"in the words of the great philosopher , aubrey graham back to back for the niggas that did n't get the message a glimpse of back work from yesterday . gym tip take your regular weight limit on a machine and add 5-10 lbs",3,Weight Loss Drugs,6.400489382940577e-08
"it actually is a symptom of capitalism that a drug ( ozempic ) that was originally developed to treat diabetes is now being funneled into medspas only for the rich to use it to maintain skinny beauty standards . oh , and ofc the price of it will only shoot up to benefit capitalists",3,Weight Loss Drugs,2.6792129119712627e-06
some of us are over here busting our asses to get wegovy prior auths approved for our patients while you got shady semaglutide compounding clinics handing out shots like its candy .,6,Weight Loss Drugs,4.143284826341187e-09
i liked a high-value mans photo on a dating app he rejected me because im fat by a. diaz,3,Weight Loss Drugs,1.42518944673481e-16
my coochie is chewing these lace panties like shes been on keto,3,Weight Loss Drugs,5.405146180474641e-22
it actually does n't take very long to see muscle gains from strength training,3,Weight Loss Drugs,2.26290771249076e-22
"weight-watchers is buying digital health company sequence , marking the diet companys move into the hot market for diabetes and obesity drugs including ozempic .",3,Weight Loss Drugs,8.290719673287317e-12
offer name powershape de category health/nutra verticle cod daily cap 50 payout $ 23.00 countries de os/brand windows phone linux mac os iphone ipod ipad preview url description powershape weightloss capsules . content capsules in a package .,6,Weight Loss Drugs,2.749611383023876e-07
"easo and efad position statement on medical therapy for the management of and in children and adolescents maria hassapidoua , , et al .",6,Weight Loss Drugs,3.910316948713133e-12
something new is arriving on birda next year ! we ca n't wait to announce this ! stay tuned,19,Weight Loss Drugs,5.633377242427446e-17
"in this randomized clinical trial , among adults with , a remotely delivered , self-directed behavioral lifestyle intervention , vs usual care , resulted in a statistically significant difference in that was not clinically important .",6,Weight Loss Drugs,2.68543276504829e-09
