text,community_id,community_name,perplexity
"edtwt into { not new , redoing my intro } -18 -they/them -ugw 40kg -autistic , eds -fatphobes/proana dni -pics are my fav movies and albums / to be moots ! edtwt thinspo thinsp0 ricecaketwt bonespo mealspo",7,Eating Disorder,1697.314030183824
i had a slice of veggie pizza at 3pm in work and dinner last night was at 8pm . gorgeous girlfriend gilly made delicious veggie balls in onion gravy with dauphinois potatoes . they were . is over for me as i had a glass of prosecco,1,Keto and Diet,61.18379109822159
4917626098656 lose 7-10 kgs weight in 30days,4,Healthy lifestyle and Weight Loss,290.7706189192997
edtwt necesito saber sus snacks favoritos bajos en cal .,8,Eating Disorder,2320.016901453632
guys ! ! ! i made it to 92lbs ( 41.73kg ) edtwt im so proud of myself,7,Eating Disorder,30.29093194218519
"edtwt , how do i fix my hair falling out ?",0,Eating Disorder,18.167506701526005
its now february edtwt will it be your month ?,0,Eating Disorder,66.85849279471408
"debo ser uno de los pocos anorxicos que tiene a las carnes y grasas como safe food , la dieta keto me cag la cabeza y ahora le tengo miedo a los carbohidratos",8,Eating Disorder,330.4038288310563
phyna ooo phyna x spedy weightloss congratulations phyna,14,Spam,492.5133958977473
male thinspo ! ! para o edtwt e outras subs,9,Eating Disorder,436.8624437209907
try this new 100 % natural solution to weight loss now .,4,Healthy lifestyle and Weight Loss,6.097705128075283
you must have a strong why weight loss success key,4,Healthy lifestyle and Weight Loss,227.2650901365736
back with another * this or that food poll red dessert ver . * for edtwt / are appreciated ! cals dont count ! starting a color series !,0,Eating Disorder,234.6294431631489
"mistakes your clients are likely making and how to help in many cases , your clients will greatly benefit from both personal training and lifestyle and weight management coaching . like share comment",4,Healthy lifestyle and Weight Loss,18.7629293554034
ayo edtwt what do yall plan on doing after hit ugw ? /gen,0,Eating Disorder,393.4068721817885
easy weight loss ! eat stop eat get rid of complicated diet rules and restrictions with this simple strategy that will help you achieve your weight loss goals in just 24 hours . click the link,4,Healthy lifestyle and Weight Loss,16.308785253097824
record greenhouse gases devastating effects on antarctic permafrost,19,Weight Loss Drugs,93.8077774340682
a collection of affirmations i use for weight loss ( has worked for me ! ) with random thinsp0 ! for edtwt,0,Eating Disorder,48.714672969457126
sundays thought .,5,Body Image,150425.70610076774
"acho engraado que muitas vezes o pessoal aqui do ed ( incluindo eu ) no sabem mais diferenciar se a pessoa bonespo , thinspo , magra normal , skinny fat ou chubby , as vezes achamos a pessoa mais gorda do que ela realmente",9,Eating Disorder,1058.023744550528
b0dy ch3ck for accountability . edtwt,0,Eating Disorder,1787.0509381202255
"depression for eyes health weight loss tips , ,",4,Healthy lifestyle and Weight Loss,63.20926122332468
teraz ta kawa jest w promocji w lidlu cao ma 78kcal i jest bardzo dobra ale i tak nie zastpi starbucksa ; (,0,Eating Disorder,1494.1244309950746
why gmos make you fat and damage your liver,4,Healthy lifestyle and Weight Loss,22.907422929346478
get ready to shed those extra pounds ! check out our latest video for 10 easy tips for rapid weight loss .,4,Healthy lifestyle and Weight Loss,3.578219059858913
why is actual thinspo called bonespo now all the `` thinspo '' i see nowadays are average skinny,0,Eating Disorder,45.94078011221068
intro meanspo / edtwt non edtwt dni he/him nny minor ugw 70lb | cgw 99-95lb looking for edtwt moots also jthm fans dms always open please be mean to me about my weight ( completely encouraged ) / for moots ! & lt ; 3,7,Eating Disorder,3249.768328343218
fatspo ! ! !,0,Eating Disorder,995233.8684857544
build an outfit based on my style [ male version ] an interactive for edtwt -look at the pictures from left to right ),0,Eating Disorder,51.35070287362315
grand risings soul tribe . always remember have a soulful sunday .,4,Healthy lifestyle and Weight Loss,364.5204379156858
everytime someone is racist im using them as fatspo,0,Eating Disorder,43.51742702299602
the great discovery of the exipure formula has brought about a new scenario for those who wish to lose weight naturally . official website,4,Healthy lifestyle and Weight Loss,21.27287992255686
"realized the reason meanspo doesnt work on me is its all targeted towards cis women ,",0,Eating Disorder,39.5184825598083
health officials decry mexicos deadly coca-cola addiction,4,Healthy lifestyle and Weight Loss,68.15366330578158
"surround yourself with people who have goals , ideas and aspirations",4,Healthy lifestyle and Weight Loss,2.93731981299687
i hate all of . `` oh edtwt makes me feel less alone '' oh yeah really ? then have no idea how lucky are . i was less lonely b4 i found edtwt . how can i feel so alone in a group full of like me ? honestly i still feel like the kid who 'd sit by themselves . am i truly just weird ?,0,Eating Disorder,219.4260591429185
pilate princess . thinspo & ; appreciated for edtwt,0,Eating Disorder,5624.101760880018
if you are looking to lose weight learn more i need to lose weight,4,Healthy lifestyle and Weight Loss,4.319050636725812
it feels so weird looking at edtwt accounts profile and seeing they havent posted since last year or more on and so,0,Eating Disorder,29.53455872792716
i havent used edtwt in about 3 months but ive been back for a week and it triggered me into a purging relapse ( ( why i came back when i get sad looking at most stuff on here,2,Anti Eating Disorder,47.9942322024199
edtwt what are your plans for 2023 ? is there any diet you will start in january 1st ?,0,Eating Disorder,23.75824330594458
good morning edtwt,0,Eating Disorder,305.1980242244219
$ 219 to $ dmtocollab,1,Keto and Diet,33134.026796424965
edtwt whats something most diets avoid but is totally worth the calories ?,0,Eating Disorder,40.74554378521825
[ homemade ] pickled vegetable pizza with gouda cheese,4,Healthy lifestyle and Weight Loss,26.059643373543487
why does all of edtwt have a different timezone to me this is so unfair,0,Eating Disorder,4.102721549953832
juicing deals morpilot slow masticating cold press juicer,4,Healthy lifestyle and Weight Loss,1563.7196059357452
sometimes i go to show someone something i find funny on here then i remember they do n't know i 'm on edtwt and they 're not disorded,0,Eating Disorder,16.309521669073437
edtwt just tried miso soup for like the first time ever and its honestly so good,0,Eating Disorder,6.02962820125081
the weight loss industry does n't want you to know about this revolutionary new discovery . learn more about a 100 % natural solution .,4,Healthy lifestyle and Weight Loss,2.64564885157036
"edtwt moots , i need a little help with choosing shoes this is the kind of outfits i wear most of the time ( oversize tops , small pants/skirts and pastel colors )",0,Eating Disorder,33.24276087362138
unfortunatly edtwt is too mean for me to post it,0,Eating Disorder,33.337322684077336
anyone on edtwt have experience with the patch method of birth control ? i took it off monday night and have n't replaced it cuz it supposed to be my period week . now it wednesday night and i still have n't gotten it . is this normal ?,0,Eating Disorder,25.614190264388306
"goodnight edtwt , sweet dreams .",0,Eating Disorder,782.5962279925229
spinal waves mobility for a healthy spine . learn online with me .,4,Healthy lifestyle and Weight Loss,63.81930329334974
black gym wear thinspo,0,Eating Disorder,27168.08043955957
"a week liquid fast diary ok im finally decided doing this , a just for recording my 7-days liquid fast with details . this aims to motivate myself ( probably for edtwt too )",0,Eating Disorder,366.945317590877
what are in medical weight loss shakes sarah diet pills moviebill,4,Healthy lifestyle and Weight Loss,406.7546972314662
necesito contenido meanspo pero no encuentro nd,8,Eating Disorder,1645.9040246154846
ella es mi mayor thinspo es demasiado linda y flakita,8,Eating Disorder,1376.9900165984263
low-fiber diets harm the good bacteria in your gut,4,Healthy lifestyle and Weight Loss,19.949644473059088
"fit father programme for the busy father by men health experts lose belly fat and gain fitness for confidential consultation with tests call 0734-290686 / 0725-786247 mon-sat 8.00am to 5.00pm aculaser weightloss clinic , 3rd parklands avenue , nairobi , kenya .",4,Healthy lifestyle and Weight Loss,320.33041809293724
take a look at this yummy slimming world christmas gingerbread cake recipe ! it always christmas if you 're feeling festive !,4,Healthy lifestyle and Weight Loss,33.103407333308205
the keto diet book for women over 50 a complete guide to the ketogenic diet with 50 simple low-carb recipes & ; useful tips to tz9owjv,1,Keto and Diet,43.47068120089541
edtwt what feature of your b0dy you 're most excited for to change when reach goal weight ?,0,Eating Disorder,36.41034603349699
rate the players out of 10 as england face iran in the group stage at the 2022 world cup in qatar .,4,Healthy lifestyle and Weight Loss,5.547114345380057
should someone use money to lose weight ?,4,Healthy lifestyle and Weight Loss,16.086278830631457
edtwt is like reverse group therapy,0,Eating Disorder,265.5035065645484
"hii i need edtwt moots ! ! * 16 she/her ugw 55kg racist dni kpop , drama , manga and bl/gl enjoyer^^ / to be moots ! !",0,Eating Disorder,1587.404639923843
i need more interactive edtwt and s//htwt mooots comment to be moots or if you already follow me and want me to follow back ! ! & lt ; 33,0,Eating Disorder,27.4487015773492
scrolling on edtwt in public,0,Eating Disorder,116.35707952715588
profile karen `` i lost 63 pounds in 9 months ! '',3,Weight Loss Drugs,53.76881970213864
seafood pasta,4,Healthy lifestyle and Weight Loss,157.50460240993675
good body smell makes you attractive ! call us to know more and invite wellness +91 8140390170 .,4,Healthy lifestyle and Weight Loss,36.44901736267303
remove from oven and serve with tzatziki sauce ( below ) and greek salad .,4,Healthy lifestyle and Weight Loss,18.917969185635155
"if i rawdog it and just dont eat for a week straight will i kms be real . and i mean nothing . i def have the self ctrl , i just got no clue what lvl of dangerous this is .",0,Eating Disorder,213.06661662667804
meanspo on pinterest,0,Eating Disorder,4880.04751812374
fit in 15 ( a complete weight loss program designed for women ) ebook by $ 0.99,4,Healthy lifestyle and Weight Loss,19.796378272439032
atinys where r you i know on edtwt stop pretending to be mentally okay and follow me,0,Eating Disorder,140.91390243004463
the phentermine alternative with a difference . innovative weight loss product phen24 combines a powerful daytime,1,Keto and Diet,476.3737298940961
wht is up with edtwt and calling everybody wannarexics rn also its really boring rn i dont see anyone making or this or that poles anymore,7,Eating Disorder,101.7409771521841
"consistency . follow me for more content related to weight management , pcos , and healthy nutrition ! . .",4,Healthy lifestyle and Weight Loss,21.974340941909205
nothing triggers me more then twink thinspo,0,Eating Disorder,34.163007840890835
hj eu ja vi milhares de thinspo meu deus q opresso,9,Eating Disorder,134.02565022386435
the best snacks for weight loss yahoo ! voices,4,Healthy lifestyle and Weight Loss,157.1604853453468
a very much needed ( and triggering ) s0ra ch0i thinspo,0,Eating Disorder,20.643462944492097
"no puedo ms , me odio a mi misma , si tanto lo amo , por qu sigo siendo igual ? no estoy intentando lo suficiente , as que me hice una lista para mantenerme motivada . obslove yantwt lovesicktwt edtwt 988twt",8,Eating Disorder,267.8194177464628
metafast is meant to help keep blood sugar levels normal and help people lose weight,4,Healthy lifestyle and Weight Loss,14.207698196922092
hidden little thinspo wall,7,Eating Disorder,377937.0943429241
clothes i will reward myself with when im skinny an ongoing for edtwt outfitspo thinspo,0,Eating Disorder,316.15038009387814
helllooo looking for more interactive moots ! ( please my tl is sooo dry ) -non-edtwt dni -minors dni ! ! ! -please put age in bio or smth -im 23 allspo rt/ & lt ; 3,7,Eating Disorder,119.74025593142116
"amazon deal found quest nutrition ready to drink salted caramel protein shake , high protein , low carb , gluten free , keto friendly , 11 fl oz ( pack of 12 ) price $ 16.73 clip coupon",3,Weight Loss Drugs,27.33326520864285
i summoned the bots to edtwt,0,Eating Disorder,423.5999018322552
does my layout match ? ?,0,Eating Disorder,29.14088217561693
"most of edtwt isnt disordered , they just have disordered eating",0,Eating Disorder,36.41189270501049
all about kim kardashian alleged weight loss drug that is injectable and mean for diabetics,4,Healthy lifestyle and Weight Loss,46.26382287203602
"book quotes surrounding eating disorders make sure you drink enough water thinspo , edtwt , anatwt , bonespo , ricecaketwt ,",0,Eating Disorder,84.5667679970186
need more thinspo on my tl,0,Eating Disorder,4.294784615943435
how to achieve a good work-life balance,4,Healthy lifestyle and Weight Loss,8.646739192258494
say goodbye to fatigue and hello to energy with our all-natural supplements !,6,Weight Loss Drugs,10.904163303047962
trying not to obsess over my friend but it does n't help that her bf is the perfect thinspo fuck me bro,0,Eating Disorder,4.681484237542536
hey my twitter babes,10,Body Image,38.01364730192415
[ homemade ] raspberry lemon cake .,4,Healthy lifestyle and Weight Loss,151.84274888869808
clean fast 20.5 hours ! one meal,1,Keto and Diet,3614.358270310746
healing and better health can truly be achieved at home . visit us- call us at 678-224-7411,13,Healthy lifestyle and Weight Loss,187.222965104407
forgot i had over 100 followers on my fucking edtwt acc that so embarrassing,0,Eating Disorder,40.69861743174784
"imagine being someones thinspo , should put that food down",0,Eating Disorder,23.17427424523902
"if you are looking for the best liposomal turmeric supplement in the market , you 've landed in the right page . in this article we are going to reveal what is the best [ ]",13,Healthy lifestyle and Weight Loss,30.501812293509246
"i love food and when i was given the opportunity recently to do a food tour in chicago , i jumped at the chance . i chose 'chicago food planet food tours ' because out of a total of 851 reviews on trip advisor , they had just 4 negative reviews and were",1,Keto and Diet,11.165330939172431
"teteu tapioca starch flour gluten free tapioca starch for baking & ; tickner for soups , boba , sauce , soup , gravy keto & ; veg hil6b6k",1,Keto and Diet,821.1452861196083
creamy keto carbonara recipe by,4,Healthy lifestyle and Weight Loss,1037.5451388671163
someone tell me why theres 30mg of sodium ? im so confused,7,Eating Disorder,3.2697576259892767
yesterday average weight loss for all participants on the cura program average weight loss on 22nd of february 2023 for participants of the cura weight loss program the average for women,4,Healthy lifestyle and Weight Loss,11.354162929665076
"keto salad recipes for holiday dinners these keto salad recipes for holiday dinners are great for thanksgiving or christmas , but enjoy these tasty low-carb salads all winter ! think of these ideas whenever you need a delicious salad idea for a special",4,Healthy lifestyle and Weight Loss,11.804533223926962
currently eating and scrolling thro edtwt,0,Eating Disorder,89.89333062849255
lose 7-10 kgs weight in 30days,4,Healthy lifestyle and Weight Loss,74.59266164128238
ein weiser mann sagte einmal die welt kann in zwei gruppen von menschen unterteilt werden mensc,4,Healthy lifestyle and Weight Loss,1036.2008457306997
why is most of edtwt so healthy . my entire ed experience has just consisted of starving and eating like a tablespoon of food when i get hungry and crying and vaping like i need to be like one of you guys,0,Eating Disorder,51.46155324875104
"hagan mi bingo , da igual si son mutuals o si no",8,Eating Disorder,496.969423289082
is anyone on edtwt from new england ? specifally massachusetts cus i am,0,Eating Disorder,38.913135688446026
ask your doctor if getting adjusted is right for you !,4,Healthy lifestyle and Weight Loss,10.372981976954398
caprisun only 38 cals for the whole drink ? ! edtwt,0,Eating Disorder,83.09419929053115
please let me provide the top items to recreate the health and wellness conveniently,4,Healthy lifestyle and Weight Loss,52.011259454448194
i 'll offer tips to actually dispose of surplus fat as soon as possible,4,Healthy lifestyle and Weight Loss,19.38598468227993
suomi edtwt sos mitk protein bars on niiku maultaan oikeesti hyvi en sy niit paljoo mut onnistun aina valitsee legit paskan makusia voin melkein jo kaiken toivon heitt,0,Eating Disorder,8974.624393963157
3 ways may help,4,Healthy lifestyle and Weight Loss,3953.316038008591
your choice ? ukdiabetes,4,Healthy lifestyle and Weight Loss,31967.53236879134
odio con todo mi corazon y no siento ninguna empatia por edtwt,12,Spam,282.4618551362861
okay edtwt my loves should i starve myself until they have to force food into me ? ?,0,Eating Disorder,21.36613093702144
"i 've been put on ozempic , had it on offer for weeks , and yet to still get it . fuck the people who are using it as a weight loss drug . fuck them .",3,Weight Loss Drugs,30.445308779888546
"edtwt , ricecaketwt , anatwt , thinspo , ana , mia , proana",0,Eating Disorder,251.2980443242457
i wo n't name names but the way edtwt defend weird borderline/straight up transphobic stuff is peculiar,0,Eating Disorder,199.6409364169782
today scientists and researchers have concluded that vegetarianism is considered the best it contains all the nutritious elements . our physiological structure is compatible with vegetarian food,13,Healthy lifestyle and Weight Loss,49.254584618840994
"help meee we 're doing an anonymous poll in my nutrition class where you type your answers and it shows them on the screen , , , and someone really just said artifical sweeteners make them look like thinspo ? ? ? ? ? ?",0,Eating Disorder,19.71255436628229
grand risings soul tribe . always remember have a soulful sunday .,4,Healthy lifestyle and Weight Loss,364.5204379156858
this girl who came into the dressing room while i was working was so thinspo everything she tried on was an xs and it was still all too big for her she was soooo pretty too,0,Eating Disorder,13.792894098710716
"transform your shape to a fresh appearance . consult with dr. sapan jain , bariatric surgeon at shantiraj hospital pvt . ltd. 9893074467 , 7230-005917",4,Healthy lifestyle and Weight Loss,85.59084436507932
anyone from edtwt have tips for fasting when you work everyday ? i ca n't get past day 2 without fainting,0,Eating Disorder,14.18542914305589
exipure ( official ) | weightloss $ 960 off + 2 bonuses for today only,4,Healthy lifestyle and Weight Loss,88.93477785560586
england captain leah williamson says she `` has n't got any interest '' in watching this year world cup in qatar .,4,Healthy lifestyle and Weight Loss,44.41361400173559
grand risings soul tribe . always remember have a soulful sunday .,4,Healthy lifestyle and Weight Loss,364.5204379156858
i know half of you dont have enough fiber in your diet ( i dont either ) so heres a of food with a decent amount of fiber ) edtwt thinspo thinsp0 fatspo fatsp0 bonespo bonesp0 mealspo,0,Eating Disorder,22.19223157667901
here is the canadian oil ! with or without thc check them out ! coupon code pin20,4,Healthy lifestyle and Weight Loss,60.634987745422784
bro even a booger got me purging fuckcant even relive 6 year old times no more eating boogies,0,Eating Disorder,86.06758378723174
"cbd oil 9 science-backed benefits ! like , retweet and follow us .",4,Healthy lifestyle and Weight Loss,22.98995019215606
hey edtwt come look at this i made about how i lost 5lbs in 5 days,0,Eating Disorder,25.036263513439454
edtwt how much caffeine do you consume a day ?,0,Eating Disorder,13.453210044585656
gymbro bf x thinspo gf & gt ; & gt ; & gt ; & gt ; & gt ;,9,Eating Disorder,8.6726815447224
neither my father nor the doctors seem to understand that forced recovery almost always leads to relapsing . [ ] edtwt anorexia thinspo proana,0,Eating Disorder,26.47539767470418
new year ! new beginning ! please listen to & ; share ft & ; sharing tips & ; advice for healthy for people living with,6,Weight Loss Drugs,13.039257027068771
"95 % of people improve their health by following the keto meal plan . getting the body into ketosis can be really helpful . start your new lifestyle today by taking a 2-minute quiz . your meal plan will be calculated , according to individual goals , body type , and personal needs .",1,Keto and Diet,14.424065903309684
can give me things to do instead of eating when hungry tags- edtwt anatwt ricecaketwt allspo thinspo thinsp0 meanspo,0,Eating Disorder,581.0639386857632
"hihi , looking for edtwt / to be moots ! !",7,Eating Disorder,113.85797848383535
since i left edtwt ive gotten sm worse at starving does anyone have tips ?,7,Eating Disorder,21.00236705941072
"dr. diana joy ostroff of the center for natural healing , discusses differences between ibs and ibd [ video ]",13,Healthy lifestyle and Weight Loss,48.3994565669065
", 57 , says took ' ?",3,Weight Loss Drugs,51402.6607412631
"edtwt , thank you for making life better .",0,Eating Disorder,21.518432452826755
i hope when i return from winter break my irls finally notice my weightloss,0,Eating Disorder,4.264507881422164
a mana literalmente um fatspo ambulante e ta se achando a boa samaritana,9,Eating Disorder,1040.9219461165926
good morning edtwt,0,Eating Disorder,305.1980242244219
today millions of people have adopted the health tips given by saint gurmeet ram rahim ji . revered guruji says fit body is the key to success . if you are not healthy then crores of rupees are also useless .,13,Healthy lifestyle and Weight Loss,28.214797032353665
7 best weight loss chews in 2023 discover magazine,4,Healthy lifestyle and Weight Loss,510.7022756853364
vari slim is the worlds most powerful formula that helps people eliminate excess weight,4,Healthy lifestyle and Weight Loss,14.818524534661613
thali cano mexico weightloss journey . before vs. after from 310 lbs to 210 lbs,4,Healthy lifestyle and Weight Loss,201.9545100978375
"thigh gap this , thigh gap that .. edtwt do have finger gaps ? ? ?",0,Eating Disorder,18.872587491982053
sugary drinks make you eat more,4,Healthy lifestyle and Weight Loss,37.54393764670036
"i feel so safe on the ride of edtwt i am on , everyone is so nice luv guys",0,Eating Disorder,29.550085023845792
"macie swoje ulubione konta na edtwt , ktre warto zaobserwowa ?",0,Eating Disorder,1295.4714348033317
edtwt new workout routine everytime you die do 10 jumping jacks or until you respawn,0,Eating Disorder,127.83489498117912
lrt why is rinne thinspo lmfaoo,0,Eating Disorder,2884.572374963769
happy client with their weight loss transformation . christine lost 32kg of weight in 12 weeks learn how,13,Healthy lifestyle and Weight Loss,19.310878639350044
signs you may not be eating enough to support your stress hormones . follow,4,Healthy lifestyle and Weight Loss,25.7289786934526
struggling with chronic hair skin obesity diseases come to dr ila ayurveda & ; get a permanent solution,4,Healthy lifestyle and Weight Loss,101.38260663111278
"diet shakes may help you lower your daily , which helps you lose weight . learn here why you should include weight loss in your .",4,Healthy lifestyle and Weight Loss,14.76984879751011
successful weight loss by gedeon muk $ 5.00,4,Healthy lifestyle and Weight Loss,861.2230818758305
hey edtwt what the longest you did a fast or st4rv3d ?,0,Eating Disorder,282.9460933401817
do you need to lose weight & ; get healthy ? turn your health around with this recipe ! ! ! get rid of pounds and pounds of stubborn excess fat ? click here for more information detox,4,Healthy lifestyle and Weight Loss,11.795919112818142
decided to leave edtwt for a sec and see how normal twt is doing but no . on the first trend i have seen naked parts from i never ever wanted to see the next confronted me with sh pics and the rest is unhealthy football addiction sooooo i feel safer here on edtwt,0,Eating Disorder,66.22919574640387
new to 20 australian want some moots want some group chats all new to this so the more help i can get the better,0,Eating Disorder,16.366055358210883
i found a bunch of cute protein bars i always see on edtwt at the store i bought my vitamins at ! ! ! its a sign ! ! ! ! ! ! ! ! !,0,Eating Disorder,5.616985975381871
everyone joining/rejoining edtwt to combat all the xmas food my family made so much dessert help,0,Eating Disorder,308.16897136556327
center day 26 connect,4,Healthy lifestyle and Weight Loss,23442.489618389736
proana king,0,Eating Disorder,32357.15554008753
"amino acids provide an energy source to keep the body strong and maintain healthy skin , hair & ; nails .",13,Healthy lifestyle and Weight Loss,3.054917590089381
grand risings soul tribe . always remember have a soulful sunday .,4,Healthy lifestyle and Weight Loss,364.5204379156858
`` are we using metabolic medications for thinness or health ? '',3,Weight Loss Drugs,121.929050196655
dont have to be diagnosed with a ed to be on edtwt,0,Eating Disorder,41.12038218419809
fitback keto ile salkl hayat yaam hisset ! . . . . .,4,Healthy lifestyle and Weight Loss,476.9714594757461
"detty december ready ! ! ! which hairstyle have n't i done ? ? side bar ever since i cut my hair , i actually do n't get angry as much i think more breeze touching my scalp is keeping me calmer",5,Body Image,37.963954602534464
malespo triggers me more than thinspo,0,Eating Disorder,118.34093343266792
