text,community_id,community_name,perplexity
edtwt how do y'all not binge after a long fast,0,Eating Disorder,51.48465543451522
not every idol is thinspo guys it time to stop pretending,0,Eating Disorder,59.49874566923575
". clinically proven to help you lose weight natural , herbal formula backed by numerous clinical studies proving its effectiveness . learn more about zotrim by clicking here",1,Keto and Diet,18.856923642612887
edtwt do you guys have any fear food ?,0,Eating Disorder,66.75018350727137
locals dont realize that this is edtwt not anatwt we are not going to start shaking and crying at a picture of a burger .,0,Eating Disorder,18.794648388360194
flat belly + tiny waist + curvy hips exercise at home achieve a flat belly & ; curvy hips by exercising with me everyday let go !,4,Healthy lifestyle and Weight Loss,8.481529383588546
alpilean is a diet pill that speed up fat burning .,4,Healthy lifestyle and Weight Loss,42.27606352303342
bno ahora toca hacer el hilo d meanspo d3lulu,8,Eating Disorder,1344.6528137597388
"her fans will compare wigs and photoshoot pictures but will not compare followers , engagements , milestones broken since after the show , phyna keeps winning and you gon cry for very long . rixari skin secrets x phyna shop spedy weightloss",14,Spam,111.09532550245196
"i was in class and i opened my laptop to my calorie tracker , quickly closed the window , opened chrome to edtwt , quickly closed the tab , had a heart attack and almost died",0,Eating Disorder,20.77283149075921
m parece k me sigui alguien k no es de edtwt,8,Eating Disorder,226.671409135999
exploring wellness travel trends trends in wellness travel that are set to make their mark,4,Healthy lifestyle and Weight Loss,9.36147833100502
scrolling on edtwt for an hour each morning but still getting up and eating sm,0,Eating Disorder,18.856662683170192
for the edtwt community . thought this was cute & lt ; 3,0,Eating Disorder,13.562844960458854
i dont care if find out im on edtwt actually,0,Eating Disorder,42.73896302551299
j vi de tudo agora uma pessoa participar do edtwt e reclamar de discurso proana ou de dicas de dieta o fim dos tempos mesmo,0,Eating Disorder,432.5832423985697
i tried the diy keto fasting mimicking diet for 5 days,4,Healthy lifestyle and Weight Loss,112.65200759209156
"in a clinical study , participants using ate 112 fewer calories on average , consumed less high-fat foods and stopped eating three minutes earlier than those who didnt take zotrim . guaranteed .",4,Healthy lifestyle and Weight Loss,54.23159052338259
i frogot to take my protein bars to my grandparents and now i have nothing for the next 5 days omfg | edtwt,0,Eating Disorder,24.80885121883174
"weight loss is simple with . by helping you break bad eating habits like overeating and snacking between meals , zotrim enables you to cut your daily calorie intake with . learn more , click",4,Healthy lifestyle and Weight Loss,38.07385677070765
reconozco medio edtwt pero a mi ninguno quizas solo,8,Eating Disorder,10203.580334254
edtwt is finding out about calories in cum every other week istg,7,Eating Disorder,72.63543525851192
what if i told im on edtwt .,0,Eating Disorder,100.77004708246685
above the shadows official trailer ( 2019 ) megan fox movie hd,4,Healthy lifestyle and Weight Loss,13.871264547426009
"ed twt jaki waszym zdaniem jest najlepszy sos zero , low cal dostpny na guiltfree ?",0,Eating Disorder,2438.792129298341
some thinspo because i really need this right now,0,Eating Disorder,8.20761073206137
how to lose 1 kg a week ? get our weight loss guide totally free- take weight-loss kit ( worth $ 500 ) free-,4,Healthy lifestyle and Weight Loss,33.63768755928832
not new to edtwt she/her 17 allspo ugw 42kg,0,Eating Disorder,2764.136546272068
"new to edtwt , , for mutuals",7,Eating Disorder,396.5541900195852
self love is when you get down from xxl to s size,4,Healthy lifestyle and Weight Loss,29.53623687024865
"every time you pick up food , you admit that staying fat is more important than losing weight meanspo ?",0,Eating Disorder,22.33359319107521
biggest review ever on whole grains and blood fats,4,Healthy lifestyle and Weight Loss,147.8016090100793
go check out her amazing content it will blow your mind must follow page,10,Body Image,8.118928170076432
difference between people who succeed and fail on the keto diet over 370 recipes+12 week meal plan losing 5-10lbs per week follow us for more click link in my bio to make your diet plan .,1,Keto and Diet,266.72784825963856
all of this toxic leaked gc shit is making me sooo anxious like are so many on edtwt actually transphobic & ; racist .. ? twitter showing if your mutuals are following a certain person is a curse .,0,Eating Disorder,124.03550953877112
para fin de ao ( creo que el 25 ) me voy a pasar los das donde mi ta que es daily meanspo y estoy feliz,8,Eating Disorder,456.37168039626897
marnie simpson shows off her incredible two-and-a-half stone weight loss in a racy black bikini daily mail,4,Healthy lifestyle and Weight Loss,91.9273655267946
edtwt used to actually be so comforting,8,Eating Disorder,95.14378570091758
"looking for mutuals mikey/craig it/he , autistic gay transman used to be on edtwt + shtwt , returning to edtwt 165cm , 63kgs/139lbs sw 65kgs/143lbs ugw 45kgs/99lbs i 'm friendly so please be my friend !",7,Eating Disorder,235.0506495372826
i have my own thinspo disguised widget,0,Eating Disorder,211.8085789762316
guys i recently got some new friends ( yay ) and one is like bmi 15 she so thinspo,0,Eating Disorder,70.90428704306964
"time-restricted eating may have anti-aging , anti-cancer effects medical news today",4,Healthy lifestyle and Weight Loss,474.523133543135
clean fast 23.5 hours ! one meal,1,Keto and Diet,1339.6789824646032
"diets i 've made , an ongoing edtwt 3dtwt high res low res med res intake th1nspo thinsp0 th1nsp0",0,Eating Disorder,851.8321297412866
start at 430 2021 now here am in 2023 at 255 still have a lil ways to go and everything looking good over here,4,Healthy lifestyle and Weight Loss,100.5705983272558
mealspo and thinspo are the absolute best,0,Eating Disorder,552.417466727614
new blog just up . the secrets to fat loss .,4,Healthy lifestyle and Weight Loss,13.264135479382093
my sister is the ultimate thinspo im so jealous,0,Eating Disorder,3.2730148652878697
"( , , , ) ,",4,Healthy lifestyle and Weight Loss,426.8920245730595
"it day 7 people , and there are still more coming ! do n't miss out on our free physical examination !",4,Healthy lifestyle and Weight Loss,18.37028951363612
"hiii ! im redoing my intro cause the old one was kinda bad -willow -she/her -16 ( birthday april 22 ) -56 -gw 95lbs -ugw 80lbs -non edtwt dni -dsmp stans dni thats all ! ! like to be moots , i need more interactive moots",0,Eating Disorder,111.55230860193308
gm edtwt,0,Eating Disorder,29847.06857401846
good night edtwt ! ! ! !,0,Eating Disorder,15982.311008338944
con qu cara vengo a edtwt despus del tremendo atracn q tuve lpm,8,Eating Disorder,3215.302070234302
morning edtwt ! !,0,Eating Disorder,19152.177572922843
edtwt would tear me up if i face revealed ngl,0,Eating Disorder,272.8894756019469
stuffed pepper soup,1,Keto and Diet,201.04030707867756
cute food low-c mealspo ! likes appreciated ; thinspo mealspo promia anatwt 3dtwt ricecaketwt,0,Eating Disorder,3530.89208784818
"doing an updated one of these ~ 18 ~ they/she ! ! ~ edtwt ~ barcodetwt ~ i post my thoughts n shit ~ ocd , depression , agoraphobia , panic disorder , gad who even knows atp i dont tw just dont follow fr",0,Eating Disorder,178.6024500773577
legs ~ edtwt bodycheck bonespo thinspo proana,0,Eating Disorder,3078.263237602806
weight loss shortcuts ! fastest way to lose weight !,6,Weight Loss Drugs,3.6824978496204017
my goal is to disclose the top-secret steps to reconstruct the physical condition simply,4,Healthy lifestyle and Weight Loss,125.33294675606228
yum yum yum food song kids healthy eating habits & ; nursery rhyme by kids television,4,Healthy lifestyle and Weight Loss,98.35955789711043
does me wanting this body mean i dont belong on edtwt,0,Eating Disorder,20.859132941553167
make keto delicious ! 5 minute keto salad dressing recipe !,4,Healthy lifestyle and Weight Loss,8.135379443369793
"on wednesdays we wear pink gym anxiety is so real i still feel uncomfy and new at times , because i am . posting unflattering angles while at the gym anxiety is even more real .",4,Healthy lifestyle and Weight Loss,55.00640977899754
"potrzebuje kawiarni i restauracji w krakowie/okolicach z kcal na menu , jeli jakie macie piszcie mi prosze",0,Eating Disorder,2618.693710567793
did you know ?,4,Healthy lifestyle and Weight Loss,48.36350426115066
edtwt what diet pills do take ?,0,Eating Disorder,121.26648084161376
edtwt whats fav color me personally its green,0,Eating Disorder,413.7553742900778
alpilean is a diet pill that speed up fat burning .,4,Healthy lifestyle and Weight Loss,42.27606352303342
must havee moreedtwt mootz,0,Eating Disorder,58513.96604324334
ignite drops official website buy 3 bottles get 2 + 1 free,4,Healthy lifestyle and Weight Loss,96.58460283771522
"tem aproximadamente 4 anos q eu t no edtwt . nem sinal dessa tal de mf , isso de comer ?",9,Eating Disorder,476.27572757540526
lose weight fast and easy ! click on my link to learn the secret to successful weight loss .,4,Healthy lifestyle and Weight Loss,2.95508543702761
learn about issues and her movement,4,Healthy lifestyle and Weight Loss,494.1396822257544
edtwt escria da humanidade ! cuidado gente as meninas que contam kcal vo pegar vocs ! edtwt mto pior q n4z1 ou p3d0,9,Eating Disorder,332.6355324031837
mindy kaling responds to fans food issue concerns after 40-lb weight loss following photos of huge meal yahoo entertainment,4,Healthy lifestyle and Weight Loss,681.4018473568916
siento q un amigo esta en edtwt y tengo terror a q me encuentre la cuenta,8,Eating Disorder,177.4603855275896
need some weight loss inspiration ? here are 5 easy tips for success keep a food diary eat more fruits & ; veggies drink plenty of water pack healthy snacks find a workout buddy . or you can start strong with personalised meal,4,Healthy lifestyle and Weight Loss,8.929458940420869
everything you need to know about keto,4,Healthy lifestyle and Weight Loss,5.857833127936457
people are currently actually dying and yet they still keep me here despite being medically stable ! ! ! funzies night edtwt,0,Eating Disorder,39.59403659661902
someone saw a notification that mentioned edtwt pop up now i wan na die i 'm an amateur forgot to turn off notifications,0,Eating Disorder,30.75765354954984
i saw someone using bluey as fatspo do not do that to my girl bluey,0,Eating Disorder,8.275476763943583
exipure ( official ) | weightloss $ 960 off + 2 bonuses for today only,4,Healthy lifestyle and Weight Loss,88.93477785560586
how do we feel about sauce ?,0,Eating Disorder,15.165146858743348
looking for active moots on edtwt ! i 'm phoenix they/them 23 yrs old ana b/p subtype goth/alt social/human services major kpop stan ( mostly girl groups/solo artists ) i 'm learning korean /rt + follow to be moots nonedtwt or under 18 dni,0,Eating Disorder,819.8822187833912
quick and easy miso soup | keto | intermittent fasting | holistic living downunder,4,Healthy lifestyle and Weight Loss,20.16547369132655
ai ed juro pra vocs q meu maior fatspo a mulher do meu servio com cala cintura baixa e esses pneus gigantestecos vazando pra fora,9,Eating Disorder,740.359817365291
this or that food poll vegetable dishes/sides ! ( a for edtwt ) calories dont count !,0,Eating Disorder,476.3912181528188
knwls 2023 spring summer womens runway,4,Healthy lifestyle and Weight Loss,1699.086047817147
edtwt,0,Eating Disorder,153669.17169796242
love my bf sm but he so fucking nosy it pisses me off . i told him abt some twitter argument i was in and he asked me to show him so i explained it was my edtwt account i do n't want him to look at and he was like `` that tempting '' like mind your own fucking business,0,Eating Disorder,9.669257375876104
"it october 31 , 2022 at 11:00am ! stay healthy !",4,Healthy lifestyle and Weight Loss,1168.2900024742594
spinach chickpea,1,Keto and Diet,1198.7434392477212
"__girl , interrupted thinspo for edtwt",0,Eating Disorder,13069.203103859703
gon na start working out way more edtwt ricecaketwt,0,Eating Disorder,519.931999398047
5 reasons you cant stop craving sugar ( and how to stop ),4,Healthy lifestyle and Weight Loss,4.013942359974758
skinny is become more like edtwt skinny,0,Eating Disorder,238.352189905988
benefits of boxing decreased stress weightloss improved heart health boosts to whole body strength likesharecomment,4,Healthy lifestyle and Weight Loss,229.7115240712542
get 21 free keto recipes ( yummy ) .,4,Healthy lifestyle and Weight Loss,125.93266884389912
i need more edtwt friends,0,Eating Disorder,115.53886070800267
what does potassium do for your body ? find out here !,4,Healthy lifestyle and Weight Loss,7.993802158855712
hi edtwt,0,Eating Disorder,20986.728342806444
flavonoids help fight the common cold,4,Healthy lifestyle and Weight Loss,337.41706837913574
twt hates me and wont let me make new accs so i might start posting vk3i stuff .. ? ? ? id still be on edtwt i just want to post abt my fav bands and members,0,Eating Disorder,21.460535735811888
yall do my bingo i need more moots & lt ; 3 ; edtwt shtwt,0,Eating Disorder,81.48193913234722
"the fat burn active food supplement accelerates fat tissue burning and facilitates weight control . regular use of the capsules has a positive effect on the rate of metabolism , as well as increasing efficiency and reducing fatigue .",4,Healthy lifestyle and Weight Loss,81.98810205547228
"niggas fr have the audacity to post horrible or controversial takes and be upset or bothered when people respond and point out how their wrong ? ? like bestie you knew this would happen , come down off high horse your on edtwt jus like the rest of us at a basic level /",0,Eating Disorder,34.936146075309814
omggg edtwt you do not know how excited this makes me ! !,0,Eating Disorder,20.80291301439301
joker is a thinspo fr,0,Eating Disorder,5242.807485154664
elizabeth davis from west virginia lost 64lbs with a new all natural solution to weight loss . see her story and learn more .,4,Healthy lifestyle and Weight Loss,7.026573271011572
"heyyy im madi , not new to edtwt but am relapsing and made new acc ! 13 yes young -anorexic -she/they & lt ; 3 stats ( 54 , bmi 18.5 ) dms open dni racist , sexist , homophobic , etc",7,Eating Disorder,273.754230584176
good luck americans of edtwt thanksgiving is around the corner,0,Eating Disorder,54.61746314362844
eliminating body fat very fast leads off rebuilding your prized health and well-being by using the details released in the blog site,4,Healthy lifestyle and Weight Loss,64.30339916522463
if you 'd prefer consistent weightloss look at this type of training,4,Healthy lifestyle and Weight Loss,7.535216853849824
shrink x gummies reviews fake health claims or real weight loss results ? the tribune india,4,Healthy lifestyle and Weight Loss,164.02538892024526
"not new to edtwt , looking for mutuals ! ! 17 , she/her sw 62kg gw 50 kg dni fatphobes & ; shtwt like/rt to be mutuals",7,Eating Disorder,546.8782793939241
4917626098656 lose 7-10 kgs weight in 30days,4,Healthy lifestyle and Weight Loss,290.7706189192997
more bodychecks for my edtwt,0,Eating Disorder,1852.941889950063
! story time ! i once pvrged pho in my sink cuz why not and it clogged the sink so i had to tell my mom i puked naturally to not get into trouble has anyone else done this before,0,Eating Disorder,38.56797013497795
edtwt do any of drink zevia .. they 're so good and they wo n't break a fast ( bcus app diet coke will ? ? ),0,Eating Disorder,149.02337281385329
edtwt how to get rid of skinnyfat,0,Eating Disorder,1440.943574873539
slightly more active on edtwt again because igo crazy when i have mo where to talk abt my ed,0,Eating Disorder,67.18332803041594
"'author `` has done it once again .... without question , a page turning self-help book that is as entertaining as it is enlightening . ' free on ku . asmsg kindle books selfhelp stress stressmanagement healthyliving mentalhealth",4,Healthy lifestyle and Weight Loss,79.98424558462739
"it january 30 , 2023 at 11:00am ! stay healthy !",4,Healthy lifestyle and Weight Loss,1097.2990465928078
fit form keto 2 pack axpli9p,1,Keto and Diet,10152.313484704246
we stray further and further away from true thinspo everyday,0,Eating Disorder,3.941222971697562
yall should follow me so i can reach my goal of being edtwt famous also lip reveal,0,Eating Disorder,16.70949813822148
the weekend & ; are here . its happy hour somewhere and this bottle is done .,5,Body Image,39.06819303959765
i love bonespo its so pretty,0,Eating Disorder,348.9080639616297
grand risings soul tribe . always remember have a soulful sunday .,4,Healthy lifestyle and Weight Loss,364.5204379156858
"me llaman martn o nacho , uso l/elle nuevo en edtwt y shtwt tengo 14 , vamp gtico y chileno eschucho de todo pero mis favs son the cure , soad y xdinary heroes me gusta marvel , south park , sanrio y ms vivo en stgo y quiero mutuals chilenxs & ; para mutuals",8,Eating Disorder,1946.482617512023
"what is the typical age at death for a baby boomer ? based on your age , health and other factors , how long are you likely to live ? this post has fascinating facts about american longevity . link",1,Keto and Diet,4.995047750545687
hermanas q chota hacen en edtwt si estn en recovery son taradas ustedes o q,8,Eating Disorder,604.7239960661934
weight loss of 60 lbs in 8 weeks click here,4,Healthy lifestyle and Weight Loss,19.88377117725496
"cardamom , also known as cardamon or watercress , is a spice that has long been used in gastronomy and medicine . although its regions of origin are in the middle east , [ ]",13,Healthy lifestyle and Weight Loss,18.919562805096035
mi mente 24/7,8,Eating Disorder,10423.552487165009
"day 14 of tiny girl diet 753 cals eaten and about 2,5k cals burned . i allowed myself to eat a bit more , going back to 500 cals tomorrow still havent weighted myself after last week binge , but i can see i lost a bit of weight thinspo , 3dtwt , ricecaketwt , anatwt , edtwt",7,Eating Disorder,59.02245275208672
botcho cream can make your butt bigger ? ( the truth ),4,Healthy lifestyle and Weight Loss,29.810486664701106
[ homemade ] strawberry milk never gets old,4,Healthy lifestyle and Weight Loss,5.048253955768367
inmit | the world first intermittent fasting support,4,Healthy lifestyle and Weight Loss,425.9772687319479
abro hilo d lo q como en la posada d la escuelita para k m usen d fatspo,8,Eating Disorder,500.52589077220017
& gt ; & gt ; & gt ; easy weight loss ! eat stop eat get rid of complicated diet rules and restrictions with this simple strategy that will help you achieve your weight loss goals in just 24 hours . click this link,4,Healthy lifestyle and Weight Loss,12.589994669984318
"do you know what is the secret to beat all the diseases and boost your immunity ? practice of meditation along with pranayam boosts oxygen level in body , increases willpower and helps you fight all diseases , as told by saint gurmeet ram rahim ji .",13,Healthy lifestyle and Weight Loss,6.8036560367561245
why do i love bonespo or deathspo so much even tho i dont wan na look like them ? like i eat ts up but not how i wan na look,0,Eating Disorder,127.8721231696822
"edtwt , how many calories do you guys think this is ? its chicken and i think my scale said it was 9.8 ounces",0,Eating Disorder,16.22470215756737
i wonder what the first thinspo i ever saw was,0,Eating Disorder,4.294934857167827
"eaton hemp , toasted super seeds , maple cinnamon flavor , healthy superfood snack , gluten free , keto , paleo , fiber and protein 6ogpped",1,Keto and Diet,145.03038156067657
edtwt help me quick should i get a gym membership or keep working out at home for free,0,Eating Disorder,5.542041237061382
raising our protein game at taj fort aguada resort & ; spa on this protein day ! indulge in delicious smoothies and protein bars . cheers to good health and great taste !,4,Healthy lifestyle and Weight Loss,150.17161904830309
"da minhas coxa de semana passada , to obesa ( aceito meanspo (",9,Eating Disorder,799.3417176068593
sharing my new fav thinspo pics / runway pics,0,Eating Disorder,34.328193873737256
december bulu box,4,Healthy lifestyle and Weight Loss,77395.67741232585
food poll for edtwt brownies ! ( cals do n't count ) + appreciated !,0,Eating Disorder,106.4302936737015
why do some people on edtwt automatically assume youre faking when you say you dont want to look like a skeleton what,0,Eating Disorder,6.159048593263269
dont call it a diet . take some healthy eating measures to reduce weight,4,Healthy lifestyle and Weight Loss,4.56327979207533
las tipas de este video fueron mi primer thinspo,8,Eating Disorder,81.85526530020817
new year ! new beginning ! please listen to & ; share ft & ; sharing tips & ; advice for healthy for people living with,6,Weight Loss Drugs,13.039257027068771
"buenas noches , edtwt ! ! ! feliz ao nuevo y todo eso .",0,Eating Disorder,28.734351073882397
diet accountability ! ( edtwt ),0,Eating Disorder,14015.610722695466
free plant power book for weight loss available at,4,Healthy lifestyle and Weight Loss,90.8635900403595
did the thing for edtwt,0,Eating Disorder,221.14767520801465
my childrens may be disabled and im fine with that,4,Healthy lifestyle and Weight Loss,24.25396493690807
filipino edtwt moots saan na kayoo t___t,0,Eating Disorder,288.74940929203206
quer meanspo ? s subir na balana que vc toma vergonha na cara,0,Eating Disorder,293.64173987236063
how to workout on the diet likesharecomment,4,Healthy lifestyle and Weight Loss,696.5645016618009
presents im getting myself when i reach my gw a for edtwt .~ * . *,0,Eating Disorder,490.0230211119589
"jude he/him 17 i like mcr , horror podcasts , horror media , biology and archaeology byf i am on edtwt , i post abt my ed sometimes and interact with on edtwt regularly dni & gt ; 15 fatphobes/allspo proana/promia anti neos transphobic , homophobic , racist etc . mcredtwt , edtwt",0,Eating Disorder,411.283642130316
my non ed irls dont get edtwt and its showing (,0,Eating Disorder,126.51400262132276
nothing is worse than unironically eating seasonimg as a snack because it has flavor and no calories,0,Eating Disorder,11.960659226270344
"edtwt started a 400 hour water fast , will be done by 17th december which kinda works out cuz i can have a small meal then fast until christmas so thats overall 16 days fast then a week fast , hopefully will lose the weight i need to by then",0,Eating Disorder,53.18400197684404
how do i sign up for noom ? read the full article is noom for guys ? the definitive answer .,4,Healthy lifestyle and Weight Loss,10.417843887689536
i wan na ask for meanspo but ik itll make me cry,0,Eating Disorder,48.77593894320869
edtwt what are your safe foods ?,0,Eating Disorder,193.4333327076131
"thai women youthful tips , secrets you may not have known before . cd/kcd and when you are only hungry to eat . we just eat meat , salt , and eggs .",4,Healthy lifestyle and Weight Loss,130.34141894241097
edtwt please reply w febuary calorie trackers or smthn i cant find any,0,Eating Disorder,101.80064625902747
for dutch edtwt maaltijd inspo van de jumbo like & ; retweet,0,Eating Disorder,422.35794673862034
edtwt is it okay to say you have bulimia/ednos without ever being diagnosed ?,0,Eating Disorder,104.16567615385472
gm edtwt say it back,0,Eating Disorder,177.86461638790223
want to lose weight ? incorporate more protein into your diet ! it can help you feel fuller longer and promote muscle growth .,13,Healthy lifestyle and Weight Loss,4.753772251968786
nahh it be the fatphobic seeing younger on edtwt talking abt `` this is so sad `` `` this makes me sad `` `` im crying `` like,0,Eating Disorder,149.1361032825459
"edtwt lets make a of banger songs , could be any genre rlly , just great songs , even ed type songs obvs its edtwt if this goes nowhere pretend it didnt happen",0,Eating Disorder,69.16622160786878
edtwt eds r not just a teenage white girl issuee ughhh any oneee can have ed no matter age race or gender ! ! ! ! ! ! mark hi edtwt fake faker fake ai generated faek fake house fake pics,0,Eating Disorder,49.26133697200724
hi if i made a stay edtwt gc would anyone like to join ? just for funnsies and to make friends,7,Eating Disorder,22.45181879007971
adopt the foregoing daily diet opportunity to make sure you diminish your additional fat really fast as well as refurbish wellbeing,4,Healthy lifestyle and Weight Loss,55.81398564188456
?,4,Healthy lifestyle and Weight Loss,2211042.00264994
respond or ill die edtwt,0,Eating Disorder,480.4557386674685
play in a league that puts you first . sign up now .,4,Healthy lifestyle and Weight Loss,2.159974678598844
"saint gurmeet ram rahim ji suggests that a meditative practice and pranayama coupled with mindful eating habits , are the keys to healthy body . how to lose weight fast & ; naturally | heart-to-heart with msg part 9 |",13,Healthy lifestyle and Weight Loss,33.853738981556205
have a listen to my latest episode of my,4,Healthy lifestyle and Weight Loss,10.688819076741158
"keto/low carb is the best diet well , what if my goal , like many other people , is to build muscle ? can you objectively say that would be the best diet for us ? the answer is no , it wouldnt be due to anabolism of carbohydrates . this is what i mean by goal matters in context .",1,Keto and Diet,19.497252330011403
fast weight loss does not promote weight regain,4,Healthy lifestyle and Weight Loss,22.62231022350435
add to help welcome to consult for investment in a suitable,4,Healthy lifestyle and Weight Loss,454.5692417583947
