text,community_id,community_name,perplexity
i hate my family . my mom thinks she is cool because she did some things and i said that is not something to be proud of that in my opinion and my stepdad said to me if im sick in my head after i response that hurts he starts to say i take everything personally edtwt,0,Eating Disorder,10.791312933704887
"malespo but like , for me anatwt , ricecaketwt , edtwt , bodyspo , moots , mascspo",0,Eating Disorder,403.8271670266158
"imc 17.3 , vc pode ser thinspo claro ! s fazer exerccios e cuidar da alimentao",9,Eating Disorder,1052.7184519151206
i fucking did it i got shtwt on my timeline instead of soft pro-recovery-edtwt hell yeah,0,Eating Disorder,46.275092989690656
edtwt in my head,0,Eating Disorder,527.7213114001563
best part about living in a foreign country is no longer having to worry about how much weight i might gain at holiday dinners i can sit at home and starve now | edtwt,0,Eating Disorder,8.306556860883267
qn es su thinspo ? la ma es natalie portman en black swan ( nina sayers ),8,Eating Disorder,88.96560769370853
congratulations phyna trending in no 3 liberia no 3 cte divoire no 3 sudan no 4 cuba phyna x spedy weightloss congratulations phyna,14,Spam,826.8022183859727
"lets chat today about an amino acid called taurine . its vital for your body . benefits include , eye health , improved hearing , strong heart , clear brain , and protects your musculoskeletal system .",1,Keto and Diet,33.873469622877224
edtwt not knowing how to read . a on going .,0,Eating Disorder,274.3330584716152
rly hope my weightloss keeps going .. it was so nice to wake up to 61.9 on the scale today & gt ; & lt ; even if its 62 it was nice to see 61 !,0,Eating Disorder,18.190963244738203
the latest daily keto tips ! shouts to,1,Keto and Diet,425.6735498293663
bella thorne gives hint of midriff in sheer black ensemble on day three of sundance film festival,3,Weight Loss Drugs,13.3874797391787
health,4,Healthy lifestyle and Weight Loss,67914.78166518283
delicious keto recipes get for free,1,Keto and Diet,61.95657672009233
hello edtwt i 'm here to come out as a tomato liker i hope you can accept me,0,Eating Disorder,33.04481973058475
"75 day challenge 75 days to mental toughness , health and fitness journal to keep track of food",4,Healthy lifestyle and Weight Loss,8.798649581730842
a rare face post for edtwt,0,Eating Disorder,2661.0722407943404
in 30 days without exercise check out here,4,Healthy lifestyle and Weight Loss,95.2238529692364
edtwt whats favorite low cal/high protein meals ? trying to make a program that chooses meals for me but my mind stopped working,0,Eating Disorder,39.6190815309414
your daily reminder to stay hydrated !,4,Healthy lifestyle and Weight Loss,3.0935355339602757
i feel so fat to be on edtwt today,0,Eating Disorder,27.99244867455281
"hey edtwt , how many of you are also on antidepressants ?",7,Eating Disorder,26.47129230262755
our advent calendar of support continues in group this week . what would work for me ? will be what we 'll be deciding,4,Healthy lifestyle and Weight Loss,23.22882732585705
if i get lower than an a on my test tmr imma fast for a week ( im 100 % gon na get lower than an a ) edtwt,0,Eating Disorder,5.017149383725618
losing 8.5 pounds in just 9.3 weeks unbelievable amazing story,4,Healthy lifestyle and Weight Loss,272.124859335953
fresh and fabulous caprese salad,4,Healthy lifestyle and Weight Loss,133.82167977452306
if youre looking to lose fat then you have to try this brand new custom keto meal plan .,4,Healthy lifestyle and Weight Loss,6.171478321834271
"hii new to edtwt 8teen , viet , she/her looking for moots thatll hold e/o accountable luvs kp0p n kdr4mas spiritual / manifesting pro recovery , dni if g0re/sh fatphobe / to be moots !",7,Eating Disorder,402.0332986389349
grand risings soul tribe . always remember have a soulful sunday .,4,Healthy lifestyle and Weight Loss,364.5204379156858
im such a fucking idiot i was just using edtwt on the school wifi without even realising fuck,0,Eating Disorder,5.08564237148994
"today wieiad breakfast protein powder porridge lunch protein shake , tangerine dinner scrambled egg sandwich snack 1 rusk i do n't count cals , later",0,Eating Disorder,171.70410326329392
to my edtwt moots who dont want to be associated with/ might get triggered by shtwt feel free to unmoot me ! ! i dont want to make anyone uncomfortable,0,Eating Disorder,28.851945418908915
morning ! keto breakfast . buttered pan fried spinach with emmental and egg,1,Keto and Diet,119.95829908944371
i was scrolling in edtwt for like 3h and i didnt even notice ? ?,0,Eating Disorder,10.693089044378528
"intro , , ace , he/him , minor . ugw 40kg , babycuts bnha , southpark , splatoon , one piece . / to be moots ! !",0,Eating Disorder,206.97308994457777
"shrimp , avocado , spicy mayo cucumber sushi roll-ups full recipe share and follow for more keto recipes and tips .",1,Keto and Diet,61.63727719040456
fat loss secrets for free training find out more at,4,Healthy lifestyle and Weight Loss,18.16297604212763
mi mam se volvi a meter con la comida y me tiro meanspo para lo q queda del ao,8,Eating Disorder,289.8213702556648
gn edtwt ! ! !,7,Eating Disorder,13831.47158377852
eating a diet low in glycotoxins and pulses,4,Healthy lifestyle and Weight Loss,41.99709522553962
q ganas de subir un pero me da miedo q me usen de fatspo,8,Eating Disorder,290.2619212064878
"i need more moots ! ! ! / this & ; ill follow back as long as not a minor edtwt , shtwt , thinspo , bonespo , skinny , thin , weightloss , omad",0,Eating Disorder,117.4353880559103
you need a minor change in your eating habits to lose that stuck up weight ! try adding millets to your diet to help you stay fit and loose weight !,1,Keto and Diet,8.564308858380574
"first on this acc ? both r pretty similar in idea , a megaththread with text & ; videos generally revolving around a fatspo/appetite suppressant .",0,Eating Disorder,565.6960210409006
whether keto is brand new or you 've slipped a little bit . today is the start of a new year and possibly a new you . take your health into your own hands and make the change for you .,4,Healthy lifestyle and Weight Loss,13.40076029091596
benefit of coconut oil . . . .,4,Healthy lifestyle and Weight Loss,597.205451505468
"i ca n't remember the last time in my life i got through my day and was not thinking constantly about food , regardless if restricting or at my hw . wtf",0,Eating Disorder,18.14967809495548
how traveling improves your overall health,13,Healthy lifestyle and Weight Loss,21.840643524279866
who wants to make a snap gc ?,0,Eating Disorder,8.497001539313649
"some meanspo on here is corny as hell you waddled to the xl uber that was waiting for you , the ground shaking with every step you tried to take",0,Eating Disorder,62.503799940550174
guys has anyone else noticed that pepsi products give you a stomach ache/diarrhea ? i usually drink coke 0 but i recently got pepsi 0 this time and i swear every time i drink it i feel sick please i need to know if this is just me,0,Eating Disorder,22.99617703332065
why is edtwt so transphobic,0,Eating Disorder,191.62583240357304
edtwt and everyone who is good at calories how much vals do you think there is in a chicken salad with curry sauce ? pretty similar to everything on the photo ( also the size on the photo is similar ) except there was no tomato,0,Eating Disorder,62.56814050832296
directly comparing cw to thinspo is enough to kill a girl,0,Eating Disorder,23.75368401038017
edtwt does anyone else take individual pilates classes ? how are they going for you ?,0,Eating Disorder,12.254192034504044
weirdcore / clowncore a edtwt thinspo edtwt thinspo ricecaketwt starvetwt 3dtwt anamia ana mia high low res edtwtthread appreciated !,0,Eating Disorder,1457.0253151907448
"so excited to shock people at school after my weightloss , , , though theres 4 months of school left would it b that surprising if i lost it during school and came back in summer let it be a bit lighter",0,Eating Disorder,17.199171265837105
"edtwt + shtwt intro .. ~ she/her ~ bpd ~ stonerexic ~ ed , sh , & ; substance abuse tw ~ lets be moots & lt ; 33",7,Eating Disorder,634.042853667791
grand risings soul tribe . always remember have a soulful sunday .,4,Healthy lifestyle and Weight Loss,364.5204379156858
"s retuito thinspo e nunca falo nada , oq da se antisocial na vida real e na net",0,Eating Disorder,557.0452297618237
"20 % off with code sale20 zotrim , the clinically proven appetite suppressant controls hunger and cravings clinically proven to help you lose weight outperforms prescription drugs in trials",4,Healthy lifestyle and Weight Loss,135.5395606452022
i shitted again,0,Eating Disorder,7603.434050175763
"for our new followers , you are most welcome . we manufacture lactose-free , vegan and keto ice cream respectively . we have 10+ flavors . we are located in ruaka however we deliver at a fee depending on your location . reach us on 0724308015",4,Healthy lifestyle and Weight Loss,15.297467030907894
"get in shape with our ultrasonic weight loss , excess skin tightening & ; cellulite removal treatments . non invasive & ; pain free . we are fully qualified & ; insured . call 01793 627522 or visit",4,Healthy lifestyle and Weight Loss,9.815559572865451
$ 99 .5mglowestpricesguaranteed the phentermine alternative with a difference . innovative weight loss product phen2,1,Keto and Diet,1141.3028068672115
thinspo,7,Eating Disorder,30827.225004142278
|,4,Healthy lifestyle and Weight Loss,2072143.3942652133
this breakthrough research reveals the one simple strategy to treat all your annoying aches & ; pains ~~ & gt ; rtplz,4,Healthy lifestyle and Weight Loss,44.21006482666326
edtwt would you eat this to reach your ugw ? ? ?,0,Eating Disorder,72.63693585590465
"fit father programme for the busy father by men health experts lose belly fat and gain fitness for confidential consultation with tests call 0734-290686 / 0725-786247 mon-sat 8.00am to 5.00pm aculaser weightloss clinic , 3rd parklands avenue , nairobi , kenya .",4,Healthy lifestyle and Weight Loss,320.33041809293724
puradrop for weight loss support infused with superfoods that support fat burn & ; weight loss,4,Healthy lifestyle and Weight Loss,64.65938583555595
if edtwt bad why mutuals better than most of my friends ?,7,Eating Disorder,44.54302122382819
edtwt should i skip school today,7,Eating Disorder,58.909322425764536
feliz ano novo edtwt que 2023 nos traga algo de bom,0,Eating Disorder,914.3832015090178
ice soup ( ) ( it actually tasted nice somehow ) edtwt,0,Eating Disorder,117.86036840490232
i have this one rlly skinny friend ( who isnt disordered ) and shes my thinspo,0,Eating Disorder,14.24732850928017
"boosts your metabolism , balances hormones , easy chicken stew recipe is a one-pot meal , that is simple to put together , and is ready in under an hour . it makes a comfor",1,Keto and Diet,52.523003645145856
it doesnt even look like im skinny my body is literally and i just wan na be skinny . like . thinspo/with a little bit of bonespo,0,Eating Disorder,58.627919896521696
guys what is an edtwt circle,0,Eating Disorder,134.77992904132307
edtwt new hack just dropped,0,Eating Disorder,1870.3681186498056
"intr0 tw33t ( dni if fatphobic / non edtwt ) she/her , 17 y , vicki & ; i speak english and polish my current weight 51 kg ; 171 cm + 2 be mutals or friend",0,Eating Disorder,3277.9517537064607
i just got sooo fucking triggered holy shit she stunning im gon na cry so hard i dont wan na eat ever again . this is n't fair . edtwt thinspo bonespo ricecaketwt meanspo skinnytwt ed fitspo slimspo ana,0,Eating Disorder,28.44646109555703
"i made the edtwt zuchinni cake & ; roomie asked where i got the recipe & ; i said i dunno & ; hes like didnt you just make this , how do you not remember already",0,Eating Disorder,44.10730278191965
"it december 17 , 2022 at 02:00am ! stay healthy !",4,Healthy lifestyle and Weight Loss,1174.5917070957737
edtwt should i fast for the rest of the year ?,0,Eating Disorder,17.285900404068688
"me acuerdo cuando tenia 12 mi thinspo era monica de friends , diooos yo queria sus chest bones",0,Eating Disorder,498.4736794308274
alpilean is a diet pill that speed up fat burning .,4,Healthy lifestyle and Weight Loss,42.27606352303342
wtf is this shit edtwt,0,Eating Disorder,52.07188377557966
pequeno almoo,4,Healthy lifestyle and Weight Loss,49483.409875127465
when youre thinner than the thinspo,0,Eating Disorder,41.71349867159207
happy v day edtwt ! use this day as a cheat day lmaooo,7,Eating Disorder,18.73739691842492
ive permanently had my tl set to latest tweets first but now with the stupid following page twt defaults to i am for the first time seeing those annoying ass edtwt tell me ____ im curious and those all caps ? ? ? ? ? tweets . and i get the hatred all have,0,Eating Disorder,103.35370395550852
being overweight is essentially having more body fat than is necessary for optimal health . for free weightloss tips visit like share comment,4,Healthy lifestyle and Weight Loss,6.706902879149915
"herbal weight loss aid zotrim has been on the market for over 15 years , so its an extremely well established brand . once",4,Healthy lifestyle and Weight Loss,17.349635506888568
baked chicken legs drumsticks free keto diet recipes,4,Healthy lifestyle and Weight Loss,51.739943445422725
"little intro ig -15 -she/her -not new to edtwt just newer acct -sparkling zero call drink adict -dni if in recovery -bookworm -music & gt ; & gt ; | ( ` 7 | , ) like/rt to be moots ! !",7,Eating Disorder,3012.441509747528
of things my fat does for edtwt,0,Eating Disorder,1296.5516042444
keto diet meal plan for weight losebeginners,1,Keto and Diet,279.6521535907373
"you can be chancing the overall healthiness if you are toting bodyweight , you can check out this blog",4,Healthy lifestyle and Weight Loss,27.82373482317682
my thinspo board on pinterest is the only thing keeping me going,0,Eating Disorder,2.241026911747345
a for edtwt christmas this or that food poll / appreciated ! !,0,Eating Disorder,1496.3168096507231
"[ homemade ] boiled gammon , dippy eggs and soldiers .",4,Healthy lifestyle and Weight Loss,49.107724775616745
i eat in a day to weightloss plan,4,Healthy lifestyle and Weight Loss,88.4050020386556
holds saturated fat that clogs arteries,4,Healthy lifestyle and Weight Loss,33.06058651969559
-- -bdy i absurdy diet nfz -- analiza strony i jadospisw jako zwyky uytkownik . a for edtwt & ;,0,Eating Disorder,6555.367567194778
"want to go keto and lose serious weight ? my 5-day keto bootcamp for women is here ! just $ 99 , i teach you everything you need to know to do keto the right way like i did ( i lost 36 inches and 30lbs ! )",4,Healthy lifestyle and Weight Loss,20.142397614342677
como se llama la aplicacin que es como tiktok pero coreana y es re facil encontrar thinspo ?,8,Eating Disorder,620.179257891972
i will never be able to explain it to you guys but no thinspo will ever compare to watching videos of gymbros just being . like it makes me wan na be so skinny so bad but idek why,0,Eating Disorder,18.97476484992935
"saw a body check today and the responses in the comments were so fucking nasty you are literally the ugliest thing ive ever seen , you make me think of recovery ok theres such a thing as too skinny , you look gross bonespo is gross and scary , why not be slim thick ?",0,Eating Disorder,12.167963034565904
edtwt is so annoying and boring,0,Eating Disorder,93.01506947386092
"these strawberry strips r so good , only 45cals yum yum",0,Eating Disorder,18.10383486396008
everything you need to know about keto,4,Healthy lifestyle and Weight Loss,5.857833127936457
keto uniq keto candied cinnamon walnuts low carb mega bag ( 11 5 oz ) 2zseab2,1,Keto and Diet,213.31235744515348
coconut oil + haircare breakdown | the innate life blog,13,Healthy lifestyle and Weight Loss,74.73952141653957
15 skinny quotes + thinspo / is appreciated edtwt/3dtwt/thinspothread/thinspo/weightlossinspo,0,Eating Disorder,1844.501108833468
giant ongoing deathspo/bonespo tags/,0,Eating Disorder,241914.15304891323
the best exsresice for super thin legs,4,Healthy lifestyle and Weight Loss,276.4856104162019
edtwt niadanie:3,0,Eating Disorder,3164984.632705924
visit this web blog to recieve a pleasurable magic-formula which will most likely reestablish ones good being,4,Healthy lifestyle and Weight Loss,66.95274097671323
"yo ! maybe stop spending money on ozempic commercials and spend it on ozempic production ? just a thought . sincerely , a retail pharmacist sick of telling people drugs are on backorder .",3,Weight Loss Drugs,40.673079714491614
if i have to scream this again i will hurt edtwt ! ! use cinnamon supplements ! ! one pill a day its not that hard guys ! !,0,Eating Disorder,10.210577539734055
te vi en mi tl nada ms pero pasaba a decir q tenes pinta d ( medio ) buena mina aaa no soy de edtwt pero ten graciass random tqm,8,Eating Disorder,506.5970660069118
do you live with epilepsy ? do you have questions about keto for epilepsy ? info.org,4,Healthy lifestyle and Weight Loss,10.49276865432891
hello edtwt i vor my password back who is still here,0,Eating Disorder,340.36501291343706
cookyourmeal how to make garlic chutney podi | chutney powder,1,Keto and Diet,94.35230791376527
"intro tweet hi , i 'm kai , nice to meet you 19 years old new to edtwt i speak portuguese and english like or follow if you wan na be moots",0,Eating Disorder,20.870432156966192
happy new year edtwt & lt ; 3,0,Eating Disorder,32.26741459820076
keto ham and cheese crustless quiche recipe home . made . interest . read in detail | | | create new website $ 60 only,4,Healthy lifestyle and Weight Loss,239.39796431778777
`` blocking all new to edtwt accs `` just someone is new to twt doesnt mean they just started having an ed ? ? ? i 've had mine for longer than many of have been alive and i didnt join twt until last september .,0,Eating Disorder,40.04332006518027
type 2 diabetes drug semaglutide may help adolescents lose weight healthline,4,Healthy lifestyle and Weight Loss,193.8881599996892
amazing weight loss transformations over time before and after,4,Healthy lifestyle and Weight Loss,6.558154962244649
t lendo j4nt4ar s3cr3t0 e o tanto de meanspo nesse livro mds,9,Eating Disorder,671.6479284983117
r there any rammstein fans on edtwt you guys like either lana del ray or mcr rammstein mutuals when !,0,Eating Disorder,20.15586306446227
when you want a cute layout but also a chaotic one but also one that pisses of who hate edtwt,0,Eating Disorder,23.04058704625554
"exipure is one of those weight loss supplements that , combined with better habits like exercise and healthy website",4,Healthy lifestyle and Weight Loss,52.56722925738382
keto diet cookbook ( 60+ keto recipes for personal enjoyment ) ebook by $ 0.99,4,Healthy lifestyle and Weight Loss,20.242898284355974
* * * * edtwt ! ! ( / appreciation ),0,Eating Disorder,7354.455423376881
good morning guys ! i hope you all have an amazing wonderful spectacular spider man 2 day today ( thinspo dump day ),0,Eating Disorder,22.36765076064749
"instead of binging ive just replaced it with some cigarettes , its been successful . 12 days binge free |",0,Eating Disorder,26.708127762482164
edtwt would judge me for how much i eat ?,7,Eating Disorder,43.41417130166796
are there any edtwt with twt blue ?,7,Eating Disorder,161.95999481551237
halloween cake make by my mom .,0,Eating Disorder,77.2147183510991
need more meanspo on the tl,0,Eating Disorder,63.75299420503666
busco mutuals en porque me cans de hacer recovery // o para ser mutuals ! ! & lt ; 3,8,Eating Disorder,110.7766998689174
"who misses crab rangoon ? { carnivore crab rangoon } recipe ( video linked below ) shared by and of course i had to try them ! rich , creamy & ; chewy for the winwhat a treat ! my family loved them too .",1,Keto and Diet,19.275862671973197
"i have an ed but . i dont wan na be bonespo deathspo thin i just wan na be skinny and tiny and dainty and small , , , , like seeing ugws of 36kg crazy to me i just wan na be a humble weight",0,Eating Disorder,156.77126312287535
i do n't need to lose weight . i have to lose weight edtwt,0,Eating Disorder,14.188757220896084
give me your workout routines ! ! ? bvvv ? v,0,Eating Disorder,58.41540247602658
insider guide to college success the underground playbook for making great,6,Weight Loss Drugs,93.22114007937648
now reading dieting dilemma when life gets in the way,4,Healthy lifestyle and Weight Loss,123.1283266319013
"debating with myself rn whether i should eat a prune or not but like it not just a prune , it a chocolate covered prune with a nut inside anyways it really helps with metabolism so i recommend edtwt",0,Eating Disorder,11.136096965841563
i love how im my own thinspo ( 15.5 bmi before i decided to stuff my face and gain even more weight than my sw ) and mynown fatspo now,0,Eating Disorder,30.209153299572
traditional weightloss diet routines break down as excess fat returns read up on the foregoing technique in its place,4,Healthy lifestyle and Weight Loss,26.86116794318939
the frequently asked question we have avoided since the beginning of married to keto . are we obesessed with keto ? today blog looks at what keto obsession would look like and why people are so happy with themselves to throw this word around .,4,Healthy lifestyle and Weight Loss,52.90662941868205
where did the edtwt picrew link shares go i have n't seen one in so long,0,Eating Disorder,36.81337211552564
activates thermogenesis and accelerates your metabolic rate . which means more calories and more stored fat can be burned as fuel for energy . learn more click here,4,Healthy lifestyle and Weight Loss,98.8483653591947
tag me in fav thinspo,0,Eating Disorder,395.00350999942185
no way i just saw a tweet insulting edtwt and clicked on the acc only for it to be misogyny porn . but were the problem ? ? were the weirdos ? ? wtf,0,Eating Disorder,71.20115474998435
312 lbs on left november 2021 250lbs november 2022 which do you prefer on me ! ? i been mia but going to start making new content soon,5,Body Image,31.499183432799867
not new just updating . + seventeen she/they 157cm ugw . 40kg looking 4 mutuals,0,Eating Disorder,675.6295053988409
genshin edtwt gc ! feel free to post workouts calorie / food logs fasts ! + reply to join,0,Eating Disorder,564.8420811110393
"the more thinspo i look at , the less i wan na eat . air is tasty . so is water .",0,Eating Disorder,6.51362453307686
message me for details,4,Healthy lifestyle and Weight Loss,4.656573499077261
gon na relapse tonight i stg .,0,Eating Disorder,315.1429847387608
edtwt show me your december spotify receiptify,0,Eating Disorder,2524.3691352341702
the exipure supplement is fda approved and gmp certified facility . all the eight exotic ingredients are safe and will eliminate fat from the whole body . official website,4,Healthy lifestyle and Weight Loss,43.19995155654341
honestly if we had a competition on whos the skinniest account on edtwt at an specific amount of time wed all def go down a few while having fun,0,Eating Disorder,43.3778759219367
back to my regularly scheduled edtwt posting i havent eaten from being sick im getting skinnyyyyy,0,Eating Disorder,35.37821438741658
cgm + health & ; fitness + diabetes 3d app idea,4,Healthy lifestyle and Weight Loss,144.8380535900701
grand risings soul tribe . always remember have a soulful sunday .,4,Healthy lifestyle and Weight Loss,364.5204379156858
wishing i looked like my bitmoji or one of the original monster high dolls edtwt,0,Eating Disorder,22.42481095685371
my mom really gave me that thinspo today by telling ill look prettier when im skinny,0,Eating Disorder,11.210763265867437
intro ! not new to edtwt 15 he/him pronouns spanish vocaloid and the arcana & lt ; 3 looking for moots,7,Eating Disorder,117.26154059198802
this is my whole main camera roll ( theres stuff in hidden but its just thinspo and ed motivation ),0,Eating Disorder,25.841951188140563
what i use to get from fast food places vs what i get now ! a ongoing for edtwt,0,Eating Disorder,23.018096137557382
are chocolate rice cakes good or gross,7,Eating Disorder,9.81556611898995
"is cottage cheese healthy for you ? adding cottage cheese to any diet regimen , you should make sure that you have thoroughly researched the different types on the market today and their benefits .",4,Healthy lifestyle and Weight Loss,9.76106104378156
a 'lil intro hey i 'm lex canadian she/her queer sims enthusiast twenty one pilots stan eng/french very autistic / to be moots ! !,7,Eating Disorder,696.7930550727993
". . dietas low , medium y high res . { } a just for edtwt fav y plis edtwt thinspo fatspo bonespo edtw diet mealspo bonespo",8,Eating Disorder,372.6565922728335
what happens when you leave ?,4,Healthy lifestyle and Weight Loss,6.753112447362198
for . thinspo .,8,Eating Disorder,59475.11193157524
ofc proana and fatphobic bruh,0,Eating Disorder,14339.617430131646
aiai essa bicha entrou desde setembro e aparece de vez em quando s e quando aparece coloca edtwt,9,Eating Disorder,544.3366838783314
houston patients struggle to find ozempic as popularity for weight loss drugs skyrockets across social media kprc click2houston,4,Healthy lifestyle and Weight Loss,239.0686103976725
grand risings soul tribe . always remember have a soulful sunday .,4,Healthy lifestyle and Weight Loss,364.5204379156858
breakfast/lunch/dinner with a view ! my meal break from helping my son & ; dil move into their new home depot box as my dining table.left over `` ketofied '' italian manicotti w/meat sauce & ; psmf roll . i know both & ; are proud,1,Keto and Diet,196.36094709996016
un gr1ng0 idiota pelendose diciendo que un chico en edtwt es pword por subir sus que porque un minor lo puede ver shut the fuck up,8,Eating Disorder,883.0809946037094
not a real edtwt if dont love mark jones,0,Eating Disorder,164.70543514751722
