text,community_id,community_name,perplexity
a of some of my fave thinspo rn . . . .,0,Eating Disorder,23.747007865062283
* free course * free course * free course * registration for my free course is open ! ! ! `` goodbye to overeating '' will run for 4 weeks ! follow link to register,4,Healthy lifestyle and Weight Loss,16.739596579514163
una siempre vuelve donde fue feliz ( edtwt ),0,Eating Disorder,95.5927884156532
edtwt food poll drawing edition !,0,Eating Disorder,11948.876265102796
mi thinspo ms personal,0,Eating Disorder,54766.60220418128
imagina vc ver uma magrinha no edtwt e seu comentrio ser `` vou te dar uma cesta bsica '',9,Eating Disorder,264.4525387037044
edtwt lied to me konjac noodles taste like expired semen,0,Eating Disorder,157.1696672816562
guys report the lady trying to take away edtwt ginny,0,Eating Disorder,238.6842312769793
"what happens when you stop taking ozempic ? weight regain will occur . this can be mitigated by lifestyle changes while you are on medicine . i recommend a ( guided by a continuous glucose monitor ) , intermittent fasting & ; strength training .",1,Keto and Diet,37.55468883332198
how to select the right workout plan for your body type yoga or exercise,4,Healthy lifestyle and Weight Loss,21.768255150371303
"exercise accounts for only 50 % of weight loss , follow for tips on healthy eating that will help you complete the rest of the weight and get a healthier physiquehope this is useful ! if so , feel free to share , like , save and tag friends .",1,Keto and Diet,17.339896146451448
tem uns corpo bonespo que eu chego a ter um surto interno do tanto que eu acho lindo . eu fico `` o que ? ! ? ! '' quando gente daqui zoa bonespo,9,Eating Disorder,154.41625926136106
edtwt at what bmi did develop a thigh gap ?,0,Eating Disorder,198.1631678203881
stay focused !,4,Healthy lifestyle and Weight Loss,1064.2388507043484
still struggling ? slim down swiftly and safely . call sws ( swift weightloss system ) clinic for confidential consultation with tests call on 0734-290686 / 0725-786247 mon-sat 8.00am to 5.00pm .,4,Healthy lifestyle and Weight Loss,175.76825979235505
morning coffee and edtwt scroll,0,Eating Disorder,1742.1916149499286
dont let your weight get you stressed . call us today and stop stressing . ( 316 ) 651-0156,4,Healthy lifestyle and Weight Loss,25.42544700020307
ngl i have mixed feelings about the accounts that are like everybody doesnt see you lookin cute today they just see the fat rolling off back and double chin like okk . i guess its funny but its relatable tho !,0,Eating Disorder,19.4357463828601
elena gilbert thinspo,0,Eating Disorder,75313.8068270994
bro edtwt do not fucking interact . thanks,2,Anti Eating Disorder,118.16495364701017
edtwt whats opinion on this,0,Eating Disorder,536.9564454667681
wher the metalheads of sh and edtwt,0,Eating Disorder,1773.3248968448186
"i understand the sentiment but as someone who avoided edtwt as i was literally in recovery , it was still getting recommend to me by twitter , almost daily . in my feed , and notification recommendations both . my account was a nsfw account , not related to ed/similar in any way .",0,Eating Disorder,16.27228978616319
happy thursday ! started with this protein packed breakfast today ! dont forget to get free ebook `` 365 days of keto low carb recipes '' are available . click the link in below ( ) credit sweatspac,1,Keto and Diet,27.621994878471646
see what they say about their lovely keto experience,4,Healthy lifestyle and Weight Loss,71.90156401098596
helix4 is a daily vitamin that may aid in weight loss by lowering your appetite,4,Healthy lifestyle and Weight Loss,15.66673862050298
check out this new mixed media that i uploaded to !,4,Healthy lifestyle and Weight Loss,25.718074852267403
"doing this because i ca n't weigh myself , edtwt what bmi do i look like ?",0,Eating Disorder,35.27940380378513
"you can also have much potential ; a more suitable body and as well , on top of that improve and even remove your excess body fat in case you implement the foregoing program",4,Healthy lifestyle and Weight Loss,26.71357660121545
fasting so i look good in my mall outfit tmr,0,Eating Disorder,17.269290097278333
edtwt if you 're vegan and post your meals be my moot i ca n't keep surviving on salads and soup,0,Eating Disorder,14.99692209678291
"it friday finally the diet begins , need a new image",10,Body Image,92.4982971840708
im free fatspo,0,Eating Disorder,84471.48147739956
usa store only bloom nutrition green superfood,4,Healthy lifestyle and Weight Loss,7979.962548549965
"the only way to eliminate 5kg in the next 30 days . take advantage of the buy 1 get 5 promotion for us $ 29,99 , because the regular price of us $ 89.99 will be back soon .",1,Keto and Diet,49.30994635939192
i love projecting my ed onto ru1 drop ru1 ed hcs ill start ( censored name i dont want the normies to find this dont wan na get sussed again ) pjskedtwt prskedtwt prosekaiedtwt edtwt anatwt ricecaketwt,0,Eating Disorder,488.7071473756524
there are many tips given by saint gurmeet ram rahim ji for . one of them do meditation with pranayama daily in the morning and evening . it is a boon for all problems .,13,Healthy lifestyle and Weight Loss,33.148557202342
hello i 'm lyra ) i 'm looking for edtwt moots i 'm 19 i interact a lot & gt ; not new to edtwt / to be moots,7,Eating Disorder,19.52532681812015
edtwt would if we made dollspo a thing,7,Eating Disorder,301.770517037636
"edtwt , i want to b/p so bad",0,Eating Disorder,118.39317680223326
mi best friend esta en edtwt y decidimos seguirnos pke en nuestra amistad no hay secretos,8,Eating Disorder,217.8587191267688
on edtwt in public no shame,0,Eating Disorder,51.385079394531125
i guess my other friends left now are my edtwt ones at least i have something personal to share w them,0,Eating Disorder,13.689274946139673
grand risings soul tribe . always remember have a soulful sunday .,4,Healthy lifestyle and Weight Loss,364.5204379156858
guys werent lying when were saying thinspo is getting fat,0,Eating Disorder,21.55995019718548
"gopal organic raw sprouted almond butter , usda organic and gluten-free , creamy and salted 8 ounce | keto , paleo and whole ls2hocn",1,Keto and Diet,1181.7373783396954
get on oat cakes edtwt i had two for breakfast in a bowl for 75cal it was so filling,0,Eating Disorder,75.21805001359589
my mom on keto losing weight by eating a ton of butter honestly i like restricting much more,0,Eating Disorder,30.87082258159313
sh energy certified-vegan proprietary nootropic blend used in herbal medicine to relieve restlessness and nervousness,4,Healthy lifestyle and Weight Loss,152.53044892252748
my mom just said shes proud of me for going on a run little does she know,0,Eating Disorder,1.4431309624154267
being called out as edtwt bcs and called thinspo on qrt of multiple of my menfess by locals is kind of crazy bro ngl,0,Eating Disorder,82.14724641083633
edtwt,0,Eating Disorder,153669.17169796242
"experience the flavors of goa , [ i ate ] a delicious fish thali a seafood lovers dream !",4,Healthy lifestyle and Weight Loss,36.31274268005637
if you do n't know how to start ketodiet properly or do you want to lose possibly 5-10 lbs in the first week alone with keto ? ? join `` '' custom keto diet '' '' . click link in for more,1,Keto and Diet,11.452089208537425
new podcast ! `` problem fat areas-the only way to lose problem fat areas '' on,6,Weight Loss Drugs,91.94974404449262
edtwt why are so many of us banned from tinderim starting to see a pattern,0,Eating Disorder,28.107254289258805
miss ariana blessing us with thinspo today,0,Eating Disorder,18.707371927486616
"those who want to be healthy and conscious , and want to keep themselves at their right weight , contact me immediately",13,Healthy lifestyle and Weight Loss,7.302323293176568
sorry i need that edtwt video of that lady showing her pantry and explaining why her skin is so clear,1,Keto and Diet,16.64009769329158
when i eat i avoid looking through edtwt i feel so guilty,2,Anti Eating Disorder,21.14375826021949
manifesting a new honeymoon phase in the new year,0,Eating Disorder,65.68115236146936
primeshred transforms your body without losing energy or muscle mass . take advantage of today discounts when purchasing click here,4,Healthy lifestyle and Weight Loss,29.97537171337929
"do n't let weight loss be your sole focus on your journey with wegovy . remember to prioritize your overall health and well-being , including mental health and self-care .",3,Weight Loss Drugs,14.394513560588749
"exercise accounts for only 50 % of weight loss , follow for tips on healthy eating that will help you complete the rest of the weight and get a healthier physique . hope this is useful ! if so , feel free to share , like , save and tag friends .",1,Keto and Diet,17.339896146451448
"kakao to moj najwiekszy fearfood , nienawidze go",0,Eating Disorder,1016.8774321671472
i had a binge day so i wrote a meanspo so it doesnt happen again,0,Eating Disorder,28.699324835703965
fitback keto ile ketojenik n hazrlanmasn ok kolay . . . . . .,4,Healthy lifestyle and Weight Loss,450.469596526156
probiotics may lower blood sugar in diabetics,4,Healthy lifestyle and Weight Loss,28.628299890296773
have you ever made keto candied bacon at like 11pm and eaten it all with your spouse in one sitting ? not us either that 'd be crazy but it was delicious ! sorry i did n't get photos,1,Keto and Diet,15.747699088734455
do all fruits and vegetables help you lose weight ?,4,Healthy lifestyle and Weight Loss,3.0364602811707457
"purgers of edtwt , which one are you puking in",0,Eating Disorder,151.06510484346686
miyeon is such thinspo i wan na look like this in my uniform,0,Eating Disorder,28.061791409212116
"dzisiaj prawie bym powoedziala do mojej kolezanki , ze pani z ktora mielismy angielski za zastepstwo to jebane thinspo xdd no ale rel ona jest kurwa takim thinspo ta typiara i jest jeszcze jedna pani w mojej szkole co jest jeszcze bardziej ale no marzenie pogadac o tym z kolezanka",0,Eating Disorder,1121.4587522083334
not me,0,Eating Disorder,22.524951848702017
"diet is an important factor in maintaining overall and preventing or managing chronic diseases , such as alzheimer disease . in fact , what you eat may be key to [ ]",13,Healthy lifestyle and Weight Loss,11.086162001635742
"edtwt stop what doing and comment yalls fave workout videos . clh0e t ! ng , 80s workout tapes , literal just dance dances idc , just show me your faves ! !",7,Eating Disorder,215.90728576372769
late nite keto ham sammiches,4,Healthy lifestyle and Weight Loss,233.06137085840535
great home full body workout routine,4,Healthy lifestyle and Weight Loss,54.507258502417045
"almost a farce , but with pharma drivers behind the scenes now they going after hdl , as it represents real root cause of heart disease , and points to the insulin resistance that they like to distract us away from",1,Keto and Diet,74.59440737018086
who likes big bootys ? see why i 'm top 3 % worldwide ! !,10,Body Image,17.143396858219088
decided to start taking weightloss step by step ! i 'm currently 83 lbs so i 'm going to attempt to get down to 80 first,0,Eating Disorder,4.252724392350266
"i meeeann am i the only one who doesnt rly care abt the fact that someone posted their vomit here , like we are in edtwt after all , were all fucked up",0,Eating Disorder,43.67044082330506
imagine how much that new sense of confidence will impact your relationships .,4,Healthy lifestyle and Weight Loss,12.2022934095725
weightloss is just fast after you reflect on this this fabulous component that can make everyones body to raise health and well-being,4,Healthy lifestyle and Weight Loss,71.46401019216378
not happy with my diet since i came home . it not a binge but it is more than what i am used to,0,Eating Disorder,3.964598789112894
give me tips for avoiding eating with parents and grandparents,7,Eating Disorder,8.71670396115728
try the revolutionary new 100 % natural solution to weight loss now .,4,Healthy lifestyle and Weight Loss,7.480511637080822
"contains only the good stuff straight from mother nature . no fillers , no fake-stuff , and absolutely , positively no nasties . what you see is what you get . learn more about trimtone by clicking",4,Healthy lifestyle and Weight Loss,38.97699409122165
why is everybody on edtwt in a relationship ? ? ! ! ! ? ! ? ? like am i really single ? is this real ?,7,Eating Disorder,3.1189554141497875
give me your favorite thinspo,0,Eating Disorder,133.7071056038926
hello edtwt ! !,0,Eating Disorder,22757.961225919174
"i hate edtwt because some of you are so chronically online it hurts . go outside , go for a walk , read a book , get a job , idc just take a break from being online constantly",0,Eating Disorder,14.100266851471336
"so i used to have an edtwt discord server with 700+ members , would you be interested in joining a new server made by me ?",7,Eating Disorder,5.954136478627553
early life gut microbiota is affected by maternal weight status,4,Healthy lifestyle and Weight Loss,85.86486490812486
now that in no longer restricted from following im gon na lovebomb edtwt so hard y'all wont see it coming,0,Eating Disorder,36.71919005394987
keto korean cabbage pancakes | ketobaechujeon,1,Keto and Diet,264.76669856446847
what causes dj vu ?,13,Healthy lifestyle and Weight Loss,20318.45893442657
"& gt ; & gt ; & gt ; weight loss without exercise ! revolutionary amazon ritual that helps you shed pounds of raw , heart-clogging fat without hitting the gym or drastically changing your diet . click this link",4,Healthy lifestyle and Weight Loss,67.55969542514691
she outdid every single fatphobes here on edtwt,0,Eating Disorder,142.62530623474677
what a month without alcohol really does to your body,4,Healthy lifestyle and Weight Loss,3.439625544383829
like do yall see this shit ? ? and then yall wonder why a lot of woc on edtwt hate a very specific group of yall,0,Eating Disorder,5.19169107544538
am i the only one thinking about eating all day ? `` omelette pepper bowl `` attn custom ketogenic diet quiz create your own custom keto diet plan in just 3 minutes click here,4,Healthy lifestyle and Weight Loss,94.5350618374718
seriously ! who doesnt like fruit punch ? check out this crazy keto fruit punch ketones drink !,4,Healthy lifestyle and Weight Loss,7.966689794504672
its time to start feeding your brain nutritional psychiatry studies how foods can make us feel .,4,Healthy lifestyle and Weight Loss,30.48894131755351
fullness vs satisfaction such a great topic ! the eating skill of becoming more aware of when to stop is the holy grail . only easier to find .,4,Healthy lifestyle and Weight Loss,26.302253103280574
grand risings soul tribe . always remember have a soulful sunday .,4,Healthy lifestyle and Weight Loss,364.5204379156858
`` edtwt is n't for bulimics '',0,Eating Disorder,300.24714111693163
always love challenging myself . 3 goals for january 1 . dry january . no booze . 2 . only 1 meal a day which will be low carb/keto with 24 hr fasting in between 3 . 30 minutes exercise a day every day . weights or racket sports . lets see if theres any difference by the end ..,1,Keto and Diet,13.183455067649405
preciso urgente achar essa menina da minha sala bonespo eu tenho certeza absoluta que ela ta no ed me ajudemmm,9,Eating Disorder,509.4229412279803
no charges filed against minnesota police snipers who fatally shot a man during a standoff [ video ],13,Healthy lifestyle and Weight Loss,5.92667285423883
hi face reveal edtwt be nice my bangs r hella long for no reason theyre growing out might delete in like a few mins cus nervous,0,Eating Disorder,21.441224814344206
weight watchers meals in minutes cookbook 15 % off and thru 11/23,4,Healthy lifestyle and Weight Loss,56.584823566476615
someone send me bmi 14 thinspo plsplspls,0,Eating Disorder,53.12366586347152
"world best keto chocolate cake deliciously rich , moist and fudgy chocolate cake topped with creamy chocolate frosting . no flour and no sugar needed !",1,Keto and Diet,11.135826859298072
edtwt of my recently saved thinspo ( for my bf mainly ) edtwt thinspo proana pro ana skinny ricecaketwt lemonwatertwt,0,Eating Disorder,320.4716095606322
"coming down with the flu can be miserable , no doubt in that . so , we have gathered a list of tips that can help you on the road to recovery .",13,Healthy lifestyle and Weight Loss,8.914842417526204
uhhhhh calories ( getting my anorexia related tweet in so i can blabber about whatever for the next 24 hours and still feel like i 'm on edtwt ),0,Eating Disorder,75.15732155556269
"heres whats inside the best-selling keto desserts cookbook for men & ; women over the age of 50 .step-by-step instructionsfor creating every singledelicious recipe .macronutrient profiles protein , fats , carbs for every serving of each recipe .",4,Healthy lifestyle and Weight Loss,678.7883620785775
acidaburn is a dietary supplement clinically proven to stimulate weight loss in as early as 10 weeks of use .,4,Healthy lifestyle and Weight Loss,29.801735748438183
if we were mutuals and i randomly unfollowed it probably interacted with fatspo,0,Eating Disorder,32.60246132406037
disney is free fatspo holy shit,0,Eating Disorder,1887.7600857485677
"tell me if this is unhinged but when i watch fatspo vids i do little exercises for the duration . so if it a minute i do like a minute of toe taps , it good motivation and i get a lil mini workout for the day",0,Eating Disorder,33.06821273735158
edtwt girlfriends apply here,0,Eating Disorder,2906.591883604944
healthy food,4,Healthy lifestyle and Weight Loss,150.03535008024178
uncle matt i know youre on edtwt follow me we can be moots . and pro tip the scales broken so have to stand towards the right . next time put it back properly,0,Eating Disorder,110.90888416933322
a guide to the top weight loss supplements forbes,4,Healthy lifestyle and Weight Loss,20.15523633917965
someone send me 3nha meanspo i dont wan na eat,0,Eating Disorder,184.5052600144653
another poll for edtwt and moots what hardcore/beatdown song should i cover,7,Eating Disorder,120.80558254986958
that wo n't work the polls wo n't work . ( instead who wants a thinspo based on music :3 reply with fav song and i 'll give a thinspo that matches it,0,Eating Disorder,60.55635177193681
guys i removed edtwt from my bio because im selling concert tickets its kind of embarrassing to let people see it,0,Eating Disorder,6.446341387005097
do usually weigh more on period cuz like ive been eating so little yet i gained weight ughhh i miss my amennorhea days,7,Eating Disorder,48.85027513305133
fun fact edtwt,0,Eating Disorder,28650.11540533339
.,4,Healthy lifestyle and Weight Loss,463305.794399731
"boosts your metabolism , balances hormones , there is literally no recipe i have ever cooked thats easier than santa fe chicken . all you have to do is season chicken br",1,Keto and Diet,13.64967320300564
hidden secrets 27lbs fat loss in 1 week for free training find out more at,4,Healthy lifestyle and Weight Loss,19.89699837988964
"it fr is so embarrassing being fat on edtwt , why am i not 90lbs yet",0,Eating Disorder,11.487227996053496
look at this,4,Healthy lifestyle and Weight Loss,2.897153881212983
the thinnest of thinspo,0,Eating Disorder,1960.6204970291208
sweetheart day,10,Body Image,50893.29706255143
everything you need to know about keto,4,Healthy lifestyle and Weight Loss,5.857833127936457
should i make a harm reduction for long-term fasting ? im kinda horrified by the stuff i see some of you guys doing + the general lack of knowledge around how to fast properly on edtwt . you really dont have to feel like youre dying the whole time . lmk if i should tag you,0,Eating Disorder,21.205683890046217
fat loss secrets for free training find out more at,4,Healthy lifestyle and Weight Loss,18.16297604212763
consistent linear weightloss and increase in energy/focus through daily 18 hours and lowering carbohydrates increasing protein and adding saturated fats for satiety.though i am aware that visceral fat matters more than bmi but feels good to see bmi below 25 ( 1/2 ),1,Keto and Diet,508.1715508362836
people of edtwt with bfs or a significant other tell me how you did it im desperate,0,Eating Disorder,9.190684596219397
all i want is an edtwt groupchat that doesnt die in a week,0,Eating Disorder,10.088797045196385
"is edtblr even active ? did anyone ever interact with anyone else ? when i was on it , i stalked like 3 accounts . but it was so boring and repetitive . i downloaded it again because edtwt is turning softer than what edtblr was when i left was it ever interesting on there ?",0,Eating Disorder,23.02835889241966
from impossible to im possible two things you need to do to have long-term weight loss,4,Healthy lifestyle and Weight Loss,19.633752577647588
orlind ( orland ? his name . nikocados husband ) is literally giving the best meanspo . theres stuff on my hands you mean besides fat ?,0,Eating Disorder,612.9403465803109
complex carbs vs simple carbs be smart know your enemy . .,4,Healthy lifestyle and Weight Loss,21.39368533282957
"a to visualize my dream body edtwt , thinspo",8,Eating Disorder,369.0675971275976
my adopted sister just told me i wont lose weight from restricting . ok tell me why im losing lots of weight while shes 230lbs and eats like 4k cals a day how is she going to try to give me weight loss tips shes never lost weight in her life ..,0,Eating Disorder,18.15979149412197
is for half an hour enough ?,4,Healthy lifestyle and Weight Loss,16.826846466308158
"oi gnt , sou do edtwt e entrando no clepto d",9,Eating Disorder,265.8401340151977
"shred fat , get lean and transform your body without losing energy or muscle mass.learn more about primeshred by clicking here",4,Healthy lifestyle and Weight Loss,30.98863910307784
healthy eating tips,4,Healthy lifestyle and Weight Loss,9.492236125742076
pocspo for edtwt,0,Eating Disorder,29943.843677725687
"hi , i 'm maria & lt ; 3 16 dominican/puertorican she/her bi edtwt shtwt likes art , music , poems looking for moots ) tambin hablo espaol",7,Eating Disorder,219.41047972565963
"when i get home , i 'm gon na do a body check and then compare it in a few months ( wo n't post it until then so edtwt does n't crucify me )",0,Eating Disorder,28.375626755375045
edtwt ( if purge ) did any of yall have emetophobia b4 started purging ? im so curious,0,Eating Disorder,69.2401058827932
i 'm just gon na start assuming everyone has a secret edtwt acc and are just gon na talk shit abt me when i 'm just living my life . skinny mindset,0,Eating Disorder,6.449286329393464
"busco mutis de , devuelvo follow",8,Eating Disorder,8279.025608343769
"hi edtwt , this was my old acc , i kept getting locked out and now i ca n't log back in , so if i was moots with you let me know , and i would love new i can talk to as well /",0,Eating Disorder,16.065998086952213
alpilean is a diet pill that speed up fat burning .,4,Healthy lifestyle and Weight Loss,42.27606352303342
gon na take a little break from edtwt bye bye logging out,0,Eating Disorder,15.391260719682826
5 hobbies for a mental health boost,13,Healthy lifestyle and Weight Loss,93.46174405994564
for my edtwt moots i post/interact with censored and uncensored sh i dont want you to be triggered or uncomfortable so just keep that in mind anyways love yall,0,Eating Disorder,89.63357277398235
are you looking for a keto meal plan that will help you lose weight and feel great ? want to find the perfect keto plan is the perfect solution for you . the keto site,1,Keto and Diet,8.232135026651136
good night edtwt ! ! i hope november is better and all of you reach your gws or recover & lt ; 3,0,Eating Disorder,17.782107346878004
"successful weight loss is triggered by perseverance , not a magic",4,Healthy lifestyle and Weight Loss,25.789851844441504
keto hair loss doesnt have to be a thing ! easily prevent and remedy hair loss on keto with this one easy adjustment to your keto diet . read more,1,Keto and Diet,5.823609377687971
puro bardo es edtwt ahora,8,Eating Disorder,1688.8631830965635
edtwt how does my layout smell ? ?,0,Eating Disorder,125.45724035237934
chiseled .,5,Body Image,1287211.786704281
`` failure happens all the time . it happens every day in practice . what makes you better is how you react to it . '' mia hamm . . . . .,4,Healthy lifestyle and Weight Loss,10.596772303677293
i rly need a privacy screen protector so i can scroll edtwt on public,0,Eating Disorder,21.62791037709013
need more edtwt moots,0,Eating Disorder,110.82564268503504
"amigas si me cierran twt entro a la locura , edtwt es mi safe place",8,Eating Disorder,186.5737152763845
had a blast on deadlift day today ! keep pushing myself harder each session ! just finished day ! 1 more day in week with as my personal trainer !,4,Healthy lifestyle and Weight Loss,15.878800682312496
new data challenges the validity of the brown adipose tissue axis in humans,6,Weight Loss Drugs,142.96752085173895
way to go leonardo ! are you ready for a new body ? our program guarantees weight loss results .,4,Healthy lifestyle and Weight Loss,15.88589409190386
benefits of green tea how powerful & ; healthy can it be ? . .,4,Healthy lifestyle and Weight Loss,10.779437739932296
god we are on edtwt please stop talking about cum,0,Eating Disorder,39.77925403701569
"visit phd doctor never lost 60kg , they lack actual experience . get app , obesity book for weight loss or get ebook from google play",4,Healthy lifestyle and Weight Loss,80.47664697314327
"we have not only created an app people love , but created sustainable ways to monetize engagement and movement .",11,Spam,10.013895837440929
what vibes do i give off ? edtwt,0,Eating Disorder,28.1296671902342
is eating nothing but bacon considered keto ? ? asking for a friend ......,1,Keto and Diet,31.096791624907183
